datetime,ORO_cdf_inf,SHA_cdf_inf,FOL_cdf_inf,ORO_cdf_snow,SHA_cdf_snow,FOL_cdf_snow,cdf_year,cdf_month,cdf_day
10/1/1996,1768,4957,1521,0,0,0,1996,10,1
10/2/1996,2213,4683,1488,0,0,0,1996,10,2
10/3/1996,2904,4522,820,0,0,0,1996,10,3
10/4/1996,2904,5373,1110,0,0,0,1996,10,4
10/5/1996,2904,3464,1240,0,0,0,1996,10,5
10/6/1996,2904,4489,986,0,0,0,1996,10,6
10/7/1996,2904,4326,1303,0,0,0,1996,10,7
10/8/1996,3061,4134,1006,0,0,0,1996,10,8
10/9/1996,1922,3685,1823,0,0,0,1996,10,9
10/10/1996,1692,4770,1163,0,0,0,1996,10,10
10/11/1996,2491,4850,937,0,0,0,1996,10,11
10/12/1996,2808,4022,1222,0,0,0,1996,10,12
10/13/1996,1777,2884,952,0,0.01,0,1996,10,13
10/14/1996,1819,3466,935,0,0.01,0,1996,10,14
10/15/1996,2204,4046,1123,0,0.01,0,1996,10,15
10/16/1996,1953,4438,1375,0,0.01,0,1996,10,16
10/17/1996,2727,4248,1234,0,0.01,0,1996,10,17
10/18/1996,2216,4052,1414,1.21,0.2,0.63,1996,10,18
10/19/1996,3270,4259,1251,1.33,0.4,1.08,1996,10,19
10/20/1996,2092,3259,1667,1.33,0.43,1.08,1996,10,20
10/21/1996,3010,2777,1692,1.33,0.43,1.08,1996,10,21
10/22/1996,2416,4572,1056,1.35,0.6,1.08,1996,10,22
10/23/1996,2982,4223,1842,1.37,0.71,1.08,1996,10,23
10/24/1996,3376,4176,1730,1.98,1.17,1.99,1996,10,24
10/25/1996,3049,2707,1776,2.7,1.38,3.26,1996,10,25
10/26/1996,2454,3597,1558,2.93,1.5,3.47,1996,10,26
10/27/1996,2935,4421,1270,2.93,1.5,3.47,1996,10,27
10/28/1996,2768,3592,1309,2.93,1.5,3.47,1996,10,28
10/29/1996,4091,6943,1788,5.21,4.61,4.55,1996,10,29
10/30/1996,3188,3675,1606,6.25,5.24,5.38,1996,10,30
10/31/1996,2565,3583,1606,6.32,5.24,5.87,1996,10,31
11/1/1996,2565,4414,1440,6.32,5.24,5.87,1996,11,1
11/2/1996,2565,4132,1071,6.32,5.24,5.87,1996,11,2
11/3/1996,2872,3795,1167,6.32,5.24,5.87,1996,11,3
11/4/1996,2472,3768,1224,6.32,5.24,5.9,1996,11,4
11/5/1996,2355,4439,1383,6.32,5.24,5.9,1996,11,5
11/6/1996,2932,3806,1100,6.32,5.24,5.9,1996,11,6
11/7/1996,2886,4292,1335,6.32,5.24,5.9,1996,11,7
11/8/1996,3153,4292,1335,6.32,5.24,5.9,1996,11,8
11/9/1996,340,4266,938,6.32,5.24,5.9,1996,11,9
11/10/1996,2576,3529,1277,6.32,5.24,5.9,1996,11,10
11/11/1996,2335,3849,1361,6.32,5.24,5.9,1996,11,11
11/12/1996,2645,3567,1152,6.32,5.28,5.9,1996,11,12
11/13/1996,2355,4429,1082,6.32,5.28,5.9,1996,11,13
11/14/1996,2948,4384,1383,6.32,5.28,5.9,1996,11,14
11/15/1996,2353,4599,1543,6.36,5.28,6.06,1996,11,15
11/16/1996,3513,4645,1561,7.12,5.28,6.65,1996,11,16
11/17/1996,4991,5455,2629,10.47,6.53,12.97,1996,11,17
11/18/1996,9097,15403,8713,11.45,8.38,18.56,1996,11,18
11/19/1996,10021,20367,5747,17.35,16.35,20.67,1996,11,19
11/20/1996,9619,14271,4282,18.86,19.13,21.71,1996,11,20
11/21/1996,5957,11286,3055,19.73,19.89,22.92,1996,11,21
11/22/1996,7350,14690,4392,21.63,21.39,25.62,1996,11,22
11/23/1996,6644,10480,6044,21.87,21.8,26.71,1996,11,23
11/24/1996,3951,8200,3919,22.01,22.12,26.79,1996,11,24
11/25/1996,4008,7063,2953,22.26,22.22,26.85,1996,11,25
11/26/1996,3839,5924,2539,22.29,22.22,26.85,1996,11,26
11/27/1996,3374,5474,2274,22.29,22.22,26.85,1996,11,27
11/28/1996,3610,5737,2438,22.37,22.38,27.07,1996,11,28
11/29/1996,3666,5627,2467,22.37,22.41,27.33,1996,11,29
11/30/1996,3797,5087,1597,22.51,22.43,27.44,1996,11,30
12/1/1996,4007,5058,2511,24.14,22.99,29.35,1996,12,1
12/2/1996,2868,4091,3451,24.66,22.99,29.84,1996,12,2
12/3/1996,3315,6348,2848,24.66,22.99,29.84,1996,12,3
12/4/1996,3580,11342,2386,27.83,23.58,32.05,1996,12,4
12/5/1996,18714,8760,20758,34.57,26.3,39.12,1996,12,5
12/6/1996,10498,7369,12441,35.75,26.36,41.84,1996,12,6
12/7/1996,8257,16757,8412,36.52,29.29,42.08,1996,12,7
12/8/1996,8558,29775,6085,36.61,35.49,42.08,1996,12,8
12/9/1996,18225,65306,6735,39.92,41.91,43.86,1996,12,9
12/10/1996,43783,62701,14139,49.25,47.65,49.31,1996,12,10
12/11/1996,34994,33556,16438,53.77,48.35,54.17,1996,12,11
12/12/1996,30354,28863,46560,56.3,48.77,58.04,1996,12,12
12/13/1996,24668,28031,27517,57.02,49.27,60.37,1996,12,13
12/14/1996,16554,20351,16673,57.02,49.27,60.37,1996,12,14
12/15/1996,12500,16079,11372,57.02,49.27,60.37,1996,12,15
12/16/1996,10397,14546,9494,57.02,49.27,60.37,1996,12,16
12/17/1996,8453,12580,8353,57.02,49.27,60.37,1996,12,17
12/18/1996,6877,11096,7494,57.02,49.27,60.37,1996,12,18
12/19/1996,6161,9829,7178,57.02,49.27,60.37,1996,12,19
12/20/1996,-9999,11265,6454,57.8,49.38,61.67,1996,12,20
12/21/1996,-9999,10531,14620,60.44,50.07,67.09,1996,12,21
12/22/1996,7821,9372,16341,62.59,50.63,72.25,1996,12,22
12/23/1996,8214,10886,11472,65.97,51.04,73.37,1996,12,23
12/24/1996,5901,9201,8268,65.97,51.04,73.39,1996,12,24
12/25/1996,6407,9660,6926,66.05,51.04,73.41,1996,12,25
12/26/1996,15305,11576,8925,70.31,51.89,77.85,1996,12,26
12/27/1996,28061,16241,28515,76.71,53.2,84.24,1996,12,27
12/28/1996,30167,37622,25126,79.04,54.48,85.49,1996,12,28
12/29/1996,43650,75865,19637,82.91,58.68,88.05,1996,12,29
12/30/1996,85653,99838,41254,91.43,64.89,93.61,1996,12,30
12/31/1996,1.70E+05,1.63E+05,55326,102.59,72.57,97.6,1996,12,31
1/1/1997,2.74E+05,2.15E+05,1.27E+05,113.82,81.23,108.22,1997,1,1
1/2/1997,1.82E+05,1.19E+05,2.10E+05,119.4,84.3,119.05,1997,1,2
1/3/1997,1.00E+05,70515,90914,119.95,84.76,121.49,1997,1,3
1/4/1997,70254,56779,48103,119.95,84.76,121.53,1997,1,4
1/5/1997,41178,43752,32278,119.95,84.76,121.59,1997,1,5
1/6/1997,30196,35384,22108,124.75,84.76,121.61,1997,1,6
1/7/1997,25506,29276,17124,124.75,84.76,121.61,1997,1,7
1/8/1997,23177,21027,14569,124.75,84.76,121.61,1997,1,8
1/9/1997,20770,21677,7769,124.75,84.76,121.61,1997,1,9
1/10/1997,19137,18604,11331,124.75,84.76,121.61,1997,1,10
1/11/1997,16379,16560,10618,124.75,84.76,121.61,1997,1,11
1/12/1997,15677,15403,10078,124.77,84.76,121.61,1997,1,12
1/13/1997,13600,12763,9510,124.91,84.76,122.36,1997,1,13
1/14/1997,13166,11664,8659,124.91,84.76,122.36,1997,1,14
1/15/1997,13764,8947,7824,125.52,84.76,122.42,1997,1,15
1/16/1997,12185,10065,7927,125.52,84.76,123.04,1997,1,16
1/17/1997,-9999,9097,7292,125.55,84.9,123.04,1997,1,17
1/18/1997,-9999,10717,6464,125.55,84.9,123.04,1997,1,18
1/19/1997,-9999,9910,6718,125.55,84.9,123.04,1997,1,19
1/20/1997,-9999,10249,7725,126.76,85.07,125.06,1997,1,20
1/21/1997,13172,15192,9354,128.97,86.35,128.39,1997,1,21
1/22/1997,26076,16806,31161,135.01,87.57,134.41,1997,1,22
1/23/1997,21028,14266,41434,135.19,88.06,138.58,1997,1,23
1/24/1997,15914,14149,20006,138.99,88.09,139.44,1997,1,24
1/25/1997,36307,17708,31045,145.92,91.02,145.54,1997,1,25
1/26/1997,59952,51205,62309,150.24,95.59,150.65,1997,1,26
1/27/1997,40231,36682,37575,154.39,96.4,151.06,1997,1,27
1/28/1997,36858,35716,24454,155.08,97.44,151.29,1997,1,28
1/29/1997,31040,28983,19794,155.08,97.56,151.32,1997,1,29
1/30/1997,26643,26378,16480,155.08,97.56,151.32,1997,1,30
1/31/1997,23942,24655,14797,155.12,97.66,151.4,1997,1,31
2/1/1997,22226,23207,13395,155.22,98.23,151.76,1997,2,1
2/2/1997,21599,21792,12854,155.22,98.23,151.81,1997,2,2
2/3/1997,20029,20618,11070,155.22,98.23,151.81,1997,2,3
2/4/1997,18104,20458,11006,155.51,98.35,151.93,1997,2,4
2/5/1997,17125,17657,10067,155.51,98.45,152.05,1997,2,5
2/6/1997,15737,16159,9418,155.51,98.45,152.05,1997,2,6
2/7/1997,15311,15144,8838,155.64,98.55,152.4,1997,2,7
2/8/1997,13893,13660,8885,155.79,98.64,152.78,1997,2,8
2/9/1997,22540,13447,8447,155.8,98.75,152.78,1997,2,9
2/10/1997,12808,12532,8220,155.81,98.89,152.78,1997,2,10
2/11/1997,12177,12382,7688,155.81,98.89,152.78,1997,2,11
2/12/1997,11676,11881,7801,155.81,98.91,152.78,1997,2,12
2/13/1997,11458,11838,7072,155.81,98.91,152.78,1997,2,13
2/14/1997,11136,11736,6737,155.81,98.91,152.78,1997,2,14
2/15/1997,11127,11532,7056,155.81,98.91,152.78,1997,2,15
2/16/1997,10850,11452,6967,155.85,98.91,152.78,1997,2,16
2/17/1997,11521,10643,7373,156.22,99.26,153.99,1997,2,17
2/18/1997,11284,8980,7351,156.55,99.26,154.06,1997,2,18
2/19/1997,11178,11157,7274,156.67,99.48,154.14,1997,2,19
2/20/1997,10882,10475,6530,156.72,99.65,154.14,1997,2,20
2/21/1997,10597,10967,6467,156.72,99.65,154.14,1997,2,21
2/22/1997,10499,8837,6016,156.72,99.65,154.14,1997,2,22
2/23/1997,10000,8903,6368,156.72,99.65,154.14,1997,2,23
2/24/1997,9726,8115,6248,156.72,99.65,154.14,1997,2,24
2/25/1997,9578,9585,6096,156.72,99.65,154.14,1997,2,25
2/26/1997,9080,8363,5212,156.72,99.65,154.14,1997,2,26
2/27/1997,8879,8928,4632,156.8,99.86,154.43,1997,2,27
2/28/1997,7875,8202,5462,156.86,99.89,154.6,1997,2,28
3/1/1997,7875,8696,5572,156.93,99.89,154.6,1997,3,1
3/2/1997,896,9716,5261,158.37,101.79,155.86,1997,3,2
3/3/1997,7979,8292,5916,158.6,101.81,156.35,1997,3,3
3/4/1997,8326,7887,5379,158.6,101.81,156.39,1997,3,4
3/5/1997,7207,8475,4680,158.6,101.81,156.39,1997,3,5
3/6/1997,7986,8477,5145,158.6,101.81,156.39,1997,3,6
3/7/1997,696,7929,5261,158.6,101.81,156.39,1997,3,7
3/8/1997,661,8555,5307,158.6,101.81,156.39,1997,3,8
3/9/1997,6,6194,5292,158.6,101.81,156.39,1997,3,9
3/10/1997,6105,7140,5268,158.6,101.81,156.39,1997,3,10
3/11/1997,6105,7498,5509,158.6,101.81,156.39,1997,3,11
3/12/1997,634,7214,5481,158.6,101.81,156.39,1997,3,12
3/13/1997,6564,7176,5155,158.6,101.81,156.39,1997,3,13
3/14/1997,67,7648,4749,158.6,101.81,156.39,1997,3,14
3/15/1997,606,8187,5067,158.6,101.81,156.39,1997,3,15
3/16/1997,815,9457,5237,161.14,102.88,157.18,1997,3,16
3/17/1997,9537,9610,5720,162.4,104.06,157.71,1997,3,17
3/18/1997,8932,7517,5302,162.4,104.1,157.75,1997,3,18
3/19/1997,8518,8668,5375,162.4,104.1,157.75,1997,3,19
3/20/1997,8171,8073,5560,162.4,104.37,157.75,1997,3,20
3/21/1997,8567,9554,5396,162.4,104.37,157.75,1997,3,21
3/22/1997,9036,8661,5267,162.4,104.37,157.75,1997,3,22
3/23/1997,9388,8432,5636,162.4,104.37,157.75,1997,3,23
3/24/1997,9387,7550,5532,162.4,104.37,157.75,1997,3,24
3/25/1997,9472,8543,5966,162.4,104.37,157.75,1997,3,25
3/26/1997,8602,8570,5405,162.4,104.37,157.75,1997,3,26
3/27/1997,9090,8012,6062,162.4,104.37,157.75,1997,3,27
3/28/1997,9102,7861,5843,162.4,104.37,157.75,1997,3,28
3/29/1997,8510,8758,5382,162.4,104.37,157.75,1997,3,29
3/30/1997,7898,7779,4936,162.61,104.37,157.99,1997,3,30
3/31/1997,7814,7052,5045,162.93,104.56,158.66,1997,3,31
4/1/1997,6881,8217,4784,162.94,104.58,158.66,1997,4,1
4/2/1997,6698,6958,4278,162.94,104.6,158.66,1997,4,2
4/3/1997,6311,7439,4079,162.94,104.6,158.66,1997,4,3
4/4/1997,615,7157,3534,162.94,104.6,158.66,1997,4,4
4/5/1997,609,7445,3657,162.94,104.6,158.66,1997,4,5
4/6/1997,5267,6872,3318,162.94,104.6,158.66,1997,4,6
4/7/1997,5784,6982,3625,162.94,104.6,158.66,1997,4,7
4/8/1997,4977,7384,3284,163,104.73,158.73,1997,4,8
4/9/1997,5721,7043,3550,163.9,104.75,158.87,1997,4,9
4/10/1997,5041,7557,3614,163.9,104.75,158.91,1997,4,10
4/11/1997,525,6060,3405,163.9,104.75,158.91,1997,4,11
4/12/1997,4955,5419,2801,163.9,104.75,158.91,1997,4,12
4/13/1997,5283,6209,2878,163.9,104.78,158.91,1997,4,13
4/14/1997,5109,5928,3027,163.9,104.78,158.91,1997,4,14
4/15/1997,4934,6156,3572,163.9,104.78,158.91,1997,4,15
4/16/1997,4967,7266,3169,163.9,104.79,158.91,1997,4,16
4/17/1997,5426,5856,4118,163.9,104.86,158.91,1997,4,17
4/18/1997,5975,9271,4013,165.79,105.22,159.9,1997,4,18
4/19/1997,10147,6217,5581,166.96,106.67,161.5,1997,4,19
4/20/1997,8894,9227,6386,167.07,107.72,161.54,1997,4,20
4/21/1997,9846,9657,5628,167.68,107.84,161.66,1997,4,21
4/22/1997,9669,10551,5903,168.02,108.01,162.23,1997,4,22
4/23/1997,9646,10605,6231,168.47,108.74,163.29,1997,4,23
4/24/1997,8344,8740,5236,168.47,108.77,163.29,1997,4,24
4/25/1997,7630,9655,4685,168.47,108.77,163.29,1997,4,25
4/26/1997,7150,8616,4298,168.47,108.77,163.29,1997,4,26
4/27/1997,6313,7991,4331,168.47,108.77,163.29,1997,4,27
4/28/1997,6466,9415,4877,168.83,108.85,163.29,1997,4,28
4/29/1997,7003,7260,4159,168.96,108.9,163.29,1997,4,29
4/30/1997,6047,7266,3904,169,108.9,163.37,1997,4,30
5/1/1997,6201,7185,3986,169.04,108.9,163.54,1997,5,1
5/2/1997,5879,7285,3648,169.04,108.9,163.54,1997,5,2
5/3/1997,5404,6572,3216,169.04,108.92,163.54,1997,5,3
5/4/1997,5317,7491,3818,169.04,108.92,163.54,1997,5,4
5/5/1997,4723,7253,4378,169.04,108.92,163.54,1997,5,5
5/6/1997,5376,7320,3850,169.04,108.92,163.54,1997,5,6
5/7/1997,5285,7040,3782,169.04,108.92,163.54,1997,5,7
5/8/1997,4907,6629,4047,169.04,108.92,163.54,1997,5,8
5/9/1997,5320,5890,3855,169.04,108.92,163.54,1997,5,9
5/10/1997,4879,4259,4458,169.04,108.92,163.54,1997,5,10
5/11/1997,4353,4178,4357,169.04,108.92,163.54,1997,5,11
5/12/1997,4288,5141,4379,169.04,108.92,163.54,1997,5,12
5/13/1997,4511,6671,4418,169.04,108.92,163.54,1997,5,13
5/14/1997,4404,5395,4556,169.04,108.92,163.54,1997,5,14
5/15/1997,3965,5356,4542,169.04,108.92,163.54,1997,5,15
5/16/1997,5030,5506,4241,169.04,108.92,163.54,1997,5,16
5/17/1997,3591,3956,4535,169.09,108.92,163.54,1997,5,17
5/18/1997,3836,2663,4896,169.09,108.92,163.54,1997,5,18
5/19/1997,3904,5494,4226,169.09,108.92,163.54,1997,5,19
5/20/1997,3680,5529,3887,169.09,108.92,163.54,1997,5,20
5/21/1997,2242,5723,3760,169.09,108.92,163.54,1997,5,21
5/22/1997,3134,4210,3342,169.09,108.92,163.54,1997,5,22
5/23/1997,3414,8071,3738,170,109.53,164.28,1997,5,23
5/24/1997,4214,7455,3279,170.63,109.57,165.42,1997,5,24
5/25/1997,3152,4828,3537,170.74,109.57,165.42,1997,5,25
5/26/1997,3230,5544,3222,170.74,109.57,165.42,1997,5,26
5/27/1997,2631,4890,3067,170.76,109.6,165.42,1997,5,27
5/28/1997,2775,4534,2813,170.76,109.6,165.42,1997,5,28
5/29/1997,3015,4634,3545,170.76,109.7,165.42,1997,5,29
5/30/1997,3015,5130,3545,170.76,109.7,165.42,1997,5,30
5/31/1997,3015,4828,2894,170.79,109.7,165.42,1997,5,31
6/1/1997,2433,4888,3291,170.79,109.7,165.42,1997,6,1
6/2/1997,2826,4703,3134,170.79,109.73,165.42,1997,6,2
6/3/1997,3704,7191,3278,171.55,110.51,166.52,1997,6,3
6/4/1997,4287,5708,3818,172.54,113.91,168.34,1997,6,4
6/5/1997,3705,4497,6408,172.61,113.91,169.31,1997,6,5
6/6/1997,3450,4938,5825,172.61,113.91,169.4,1997,6,6
6/7/1997,3003,5078,4769,172.61,113.91,169.4,1997,6,7
6/8/1997,3218,4813,3769,172.61,113.91,169.4,1997,6,8
6/9/1997,2060,4784,3220,173.28,113.91,169.4,1997,6,9
6/10/1997,3730,5353,3912,173.48,113.91,169.4,1997,6,10
6/11/1997,2651,4460,2528,173.48,114.56,169.44,1997,6,11
6/12/1997,3047,5012,2695,173.53,114.63,169.59,1997,6,12
6/13/1997,2863,5266,1934,174.09,114.68,169.67,1997,6,13
6/14/1997,2396,6152,2423,174.09,114.68,169.94,1997,6,14
6/15/1997,2952,2998,2074,174.09,114.68,170.26,1997,6,15
6/16/1997,2997,3464,2886,174.09,114.68,170.31,1997,6,16
6/17/1997,2997,4835,3102,174.09,114.68,170.31,1997,6,17
6/18/1997,2510,4827,2450,174.09,114.68,170.31,1997,6,18
6/19/1997,2349,4782,2452,174.09,114.68,170.31,1997,6,19
6/20/1997,2549,4734,2673,174.09,114.68,170.31,1997,6,20
6/21/1997,2703,4857,1888,174.09,114.68,170.31,1997,6,21
6/22/1997,2122,4100,2155,174.09,114.68,170.31,1997,6,22
6/23/1997,1657,2920,2122,174.09,114.68,170.31,1997,6,23
6/24/1997,2056,4443,2423,174.09,114.68,170.31,1997,6,24
6/25/1997,2467,4578,2205,174.09,114.68,170.31,1997,6,25
6/26/1997,2648,4462,2105,174.09,114.68,170.31,1997,6,26
6/27/1997,1377,4415,1337,174.09,114.68,170.31,1997,6,27
6/28/1997,2167,2752,1543,174.09,114.68,170.31,1997,6,28
6/29/1997,1661,2330,1028,174.09,114.68,170.31,1997,6,29
6/30/1997,2630,5190,1474,174.09,117.63,170.59,1997,6,30
7/1/1997,1649,4403,1610,174.34,117.82,170.67,1997,7,1
7/2/1997,1520,4325,1566,174.37,118.13,170.67,1997,7,2
7/3/1997,2515,5648,1662,174.37,118.13,170.67,1997,7,3
7/4/1997,3188,3963,1964,174.37,118.13,170.67,1997,7,4
7/5/1997,1505,2573,1562,174.37,118.13,170.67,1997,7,5
7/6/1997,2313,1264,1788,174.37,118.13,170.67,1997,7,6
7/7/1997,2182,4978,1755,174.37,118.13,170.67,1997,7,7
7/8/1997,1922,4438,2520,174.37,118.13,170.67,1997,7,8
7/9/1997,2463,4622,2102,174.37,118.13,170.67,1997,7,9
7/10/1997,1482,3683,1990,174.37,118.13,170.67,1997,7,10
7/11/1997,1968,4775,1777,174.37,118.13,170.67,1997,7,11
7/12/1997,1832,2114,1921,174.37,118.13,170.67,1997,7,12
7/13/1997,2099,3327,1794,174.37,118.13,170.67,1997,7,13
7/14/1997,2065,4500,1925,174.37,118.13,170.67,1997,7,14
7/15/1997,2208,4292,2242,174.37,118.13,170.67,1997,7,15
7/16/1997,1724,4286,1983,174.37,118.13,170.67,1997,7,16
7/17/1997,1724,4294,1212,174.37,118.31,170.67,1997,7,17
7/18/1997,2158,4396,2106,174.37,118.31,170.67,1997,7,18
7/19/1997,1854,2565,2219,174.37,118.31,170.67,1997,7,19
7/20/1997,1801,2736,1093,174.37,118.31,170.67,1997,7,20
7/21/1997,2112,5032,2020,174.37,118.31,170.67,1997,7,21
7/22/1997,1804,4075,2010,174.37,118.31,170.67,1997,7,22
7/23/1997,1484,4299,1503,174.37,118.31,170.67,1997,7,23
7/24/1997,1764,4046,1949,174.37,118.31,170.67,1997,7,24
7/25/1997,1764,4451,1881,174.37,118.31,170.67,1997,7,25
7/26/1997,1764,2681,2024,174.37,118.31,170.67,1997,7,26
7/27/1997,3577,2435,1638,174.37,118.31,170.67,1997,7,27
7/28/1997,2349,4174,1582,174.37,118.31,170.68,1997,7,28
7/29/1997,2063,4001,1906,174.37,118.35,170.68,1997,7,29
7/30/1997,1997,4781,1968,174.37,118.35,170.68,1997,7,30
7/31/1997,2004,4594,1495,174.37,118.35,170.68,1997,7,31
8/1/1997,2075,4819,1903,174.37,118.35,170.68,1997,8,1
8/2/1997,1863,3794,1812,174.37,118.35,170.68,1997,8,2
8/3/1997,2442,1681,1656,174.37,118.35,170.68,1997,8,3
8/4/1997,2157,4586,1984,174.37,118.35,170.68,1997,8,4
8/5/1997,2166,4223,2186,174.37,118.35,170.68,1997,8,5
8/6/1997,1872,3800,2275,174.37,118.35,170.68,1997,8,6
8/7/1997,3096,3463,2177,174.37,118.35,170.68,1997,8,7
8/8/1997,3096,3816,1989,174.37,118.35,170.68,1997,8,8
8/9/1997,3096,2931,1771,174.37,118.35,170.68,1997,8,9
8/10/1997,3096,2624,1642,174.37,118.35,170.68,1997,8,10
8/11/1997,1627,4443,1493,174.37,118.35,170.68,1997,8,11
8/12/1997,2374,5334,1929,174.37,118.35,170.68,1997,8,12
8/13/1997,2243,3843,1988,174.37,118.35,170.68,1997,8,13
8/14/1997,2174,4340,1940,174.37,118.35,170.68,1997,8,14
8/15/1997,2074,4646,1681,174.37,118.35,170.68,1997,8,15
8/16/1997,2028,3090,1722,174.37,118.35,170.68,1997,8,16
8/17/1997,2963,2649,1641,174.37,118.35,170.68,1997,8,17
8/18/1997,2285,4325,1599,174.37,118.35,170.68,1997,8,18
8/19/1997,2353,4523,1542,174.38,119.55,170.68,1997,8,19
8/20/1997,1747,5658,1878,175.77,120.65,171.59,1997,8,20
8/21/1997,2183,4683,1938,175.77,120.65,171.59,1997,8,21
8/22/1997,2086,4810,2257,175.77,120.65,171.59,1997,8,22
8/23/1997,3196,3289,2051,175.77,120.65,171.59,1997,8,23
8/24/1997,2732,2326,2061,175.77,120.65,171.59,1997,8,24
8/25/1997,2409,4477,2316,175.77,120.65,171.59,1997,8,25
8/26/1997,2403,4470,2752,175.77,120.65,171.59,1997,8,26
8/27/1997,2650,4778,2660,175.77,120.65,171.59,1997,8,27
8/28/1997,2520,4568,2375,175.77,120.65,171.59,1997,8,28
8/29/1997,2969,4593,2552,175.77,120.65,171.59,1997,8,29
8/30/1997,2695,2944,2380,175.77,120.65,171.59,1997,8,30
8/31/1997,2344,2725,2087,175.77,120.65,171.59,1997,8,31
9/1/1997,2425,4068,2461,175.77,120.65,171.59,1997,9,1
9/2/1997,1548,3908,2725,175.77,120.65,171.59,1997,9,2
9/3/1997,2241,6232,2652,175.77,120.65,171.59,1997,9,3
9/4/1997,1774,7457,2676,175.77,120.65,171.59,1997,9,4
9/5/1997,2036,6903,2496,175.77,120.65,171.59,1997,9,5
9/6/1997,2824,2847,2125,175.77,120.65,171.59,1997,9,6
9/7/1997,1920,1520,2373,175.77,120.65,171.59,1997,9,7
9/8/1997,1377,3071,2401,175.77,120.65,171.59,1997,9,8
9/9/1997,2144,4771,2567,175.77,120.65,171.59,1997,9,9
9/10/1997,1456,5007,2867,175.77,120.72,171.59,1997,9,10
9/11/1997,1870,6011,2362,175.77,121.17,171.59,1997,9,11
9/12/1997,1762,4457,2565,175.77,121.17,171.59,1997,9,12
9/13/1997,2826,1739,2625,175.77,121.17,171.59,1997,9,13
9/14/1997,1924,3321,2010,176.66,122.15,171.87,1997,9,14
9/15/1997,1825,4934,1932,176.75,123.37,171.98,1997,9,15
9/16/1997,2435,5472,2428,176.75,123.37,171.98,1997,9,16
9/17/1997,1310,4885,2229,176.75,123.48,171.98,1997,9,17
9/18/1997,1770,3611,1877,176.75,123.53,171.98,1997,9,18
9/19/1997,1146,5094,1782,177.02,123.53,171.98,1997,9,19
9/20/1997,2435,2465,2054,177.02,123.53,171.98,1997,9,20
9/21/1997,2059,3108,1407,177.02,123.53,171.98,1997,9,21
9/22/1997,1572,3859,1587,177.02,123.53,171.98,1997,9,22
9/23/1997,2277,4675,1679,177.02,123.53,171.98,1997,9,23
9/24/1997,1200,4180,1821,177.02,123.53,171.98,1997,9,24
9/25/1997,2538,3350,1697,177.02,123.53,172.03,1997,9,25
9/26/1997,1738,4858,1160,177.02,123.53,172.03,1997,9,26
9/27/1997,1665,3046,1025,177.02,123.53,172.03,1997,9,27
9/28/1997,1677,3311,1449,177.02,123.53,172.03,1997,9,28
9/29/1997,1583,1784,1674,177.02,123.53,172.03,1997,9,29
9/30/1997,790,3821,1865,177.02,123.53,172.03,1997,9,30
10/1/1997,17,4365,1643,0.08,0,0,1997,10,1
10/2/1997,215,3465,1288,1.5,0.52,1.7,1997,10,2
10/3/1997,1240,4142,1097,1.51,0.52,1.7,1997,10,3
10/4/1997,1678,3964,1517,1.51,0.52,1.7,1997,10,4
10/5/1997,1050,2605,941,1.51,0.52,1.7,1997,10,5
10/6/1997,2070,5188,857,1.59,0.61,1.9,1997,10,6
10/7/1997,2485,4336,1334,1.62,0.73,1.9,1997,10,7
10/8/1997,5073,6019,885,4.74,1.45,2.37,1997,10,8
10/9/1997,4511,4249,1720,9.69,3.07,5.19,1997,10,9
10/10/1997,3500,5516,1754,10.29,3.12,6.56,1997,10,10
10/11/1997,3351,3390,859,10.59,3.25,7.1,1997,10,11
10/12/1997,3171,3589,1655,10.59,3.25,7.1,1997,10,12
10/13/1997,2891,3823,1989,10.59,3.25,7.1,1997,10,13
10/14/1997,3158,4577,2092,10.59,3.25,7.1,1997,10,14
10/15/1997,3014,4157,2075,10.59,3.25,7.1,1997,10,15
10/16/1997,3658,3936,1655,10.59,3.25,7.1,1997,10,16
10/17/1997,2405,6288,1897,10.59,3.25,7.1,1997,10,17
10/18/1997,3338,4974,2109,10.59,3.25,7.1,1997,10,18
10/19/1997,3232,4251,1364,10.59,3.25,7.1,1997,10,19
10/20/1997,2542,6340,1559,10.59,3.25,7.1,1997,10,20
10/21/1997,4870,4184,1036,10.59,3.25,7.1,1997,10,21
10/22/1997,2032,4494,1512,10.59,3.25,7.1,1997,10,22
10/23/1997,2065,8114,1724,10.59,3.25,7.1,1997,10,23
10/24/1997,2325,6400,1504,10.59,3.25,7.1,1997,10,24
10/25/1997,1925,822,1552,10.59,3.25,7.1,1997,10,25
10/26/1997,2797,1028,1610,10.59,3.25,7.1,1997,10,26
10/27/1997,2913,2719,1341,10.59,3.25,7.1,1997,10,27
10/28/1997,1383,4307,1839,10.59,3.25,7.1,1997,10,28
10/29/1997,2594,5023,1412,10.65,3.5,7.1,1997,10,29
10/30/1997,1835,4476,1643,10.65,3.5,7.1,1997,10,30
10/31/1997,2173,3858,2173,10.65,3.67,7.1,1997,10,31
11/1/1997,3320,3513,1480,10.65,3.67,7.1,1997,11,1
11/2/1997,2967,3782,775,10.65,3.67,7.1,1997,11,2
11/3/1997,2783,5191,1228,10.65,3.67,7.1,1997,11,3
11/4/1997,2967,4108,434,10.65,3.67,7.1,1997,11,4
11/5/1997,2034,4047,2592,10.65,3.67,7.1,1997,11,5
11/6/1997,2874,3422,1126,11.58,4.47,7.53,1997,11,6
11/7/1997,3606,4144,1406,11.91,4.81,7.75,1997,11,7
11/8/1997,3158,5163,1377,11.91,4.81,7.75,1997,11,8
11/9/1997,203,3908,548,11.91,4.81,7.75,1997,11,9
11/10/1997,3283,4674,769,12.11,4.91,7.99,1997,11,10
11/11/1997,2516,5193,1015,12.49,4.99,8.44,1997,11,11
11/12/1997,3802,4069,1429,12.56,5.02,8.62,1997,11,12
11/13/1997,3033,5888,1385,14.07,6.04,9.25,1997,11,13
11/14/1997,3795,5622,1322,15.25,7.07,10.22,1997,11,14
11/15/1997,3600,7306,1553,16.27,8.18,11.11,1997,11,15
11/16/1997,3305,11593,1293,17.82,13.27,11.46,1997,11,16
11/17/1997,2637,8303,1259,18.74,14.68,12,1997,11,17
11/18/1997,2453,7060,1591,19.58,14.97,12.56,1997,11,18
11/19/1997,3459,15303,1138,21.45,19.12,14.26,1997,11,19
11/20/1997,3708,11387,1601,21.65,19.46,14.73,1997,11,20
11/21/1997,334,6569,2159,21.65,19.46,14.75,1997,11,21
11/22/1997,2606,6757,1092,22.13,19.47,14.79,1997,11,22
11/23/1997,394,7627,845,25.4,21.14,15.54,1997,11,23
11/24/1997,3240,10445,1079,26.44,21.78,16.29,1997,11,24
11/25/1997,4680,11403,2013,27.96,22.69,17.46,1997,11,25
11/26/1997,9448,15126,3840,33.51,24.15,22.31,1997,11,26
11/27/1997,7147,12223,3378,33.72,25.24,23.84,1997,11,27
11/28/1997,5698,8704,1842,33.75,25.24,23.84,1997,11,28
11/29/1997,4975,9134,1622,33.88,26.02,23.84,1997,11,29
11/30/1997,5005,8695,1641,34.87,27.95,23.99,1997,11,30
12/1/1997,3536,6778,1759,34.87,27.95,23.99,1997,12,1
12/2/1997,4110,6294,1939,34.87,27.95,23.99,1997,12,2
12/3/1997,4803,7949,1944,34.87,27.95,23.99,1997,12,3
12/4/1997,3760,7333,1375,34.87,28.58,23.99,1997,12,4
12/5/1997,3444,7642,1382,35.33,28.75,24.46,1997,12,5
12/6/1997,4789,6278,1342,36.52,29.39,25.48,1997,12,6
12/7/1997,9574,13107,4577,40.75,32.17,30.02,1997,12,7
12/8/1997,7849,10840,5804,43.63,32.38,33.4,1997,12,8
12/9/1997,6073,8583,3420,43.65,32.41,33.93,1997,12,9
12/10/1997,5008,7177,2772,43.65,32.41,33.93,1997,12,10
12/11/1997,4852,5849,2039,43.65,32.41,33.93,1997,12,11
12/12/1997,5133,6126,1973,43.65,32.41,33.93,1997,12,12
12/13/1997,4964,7398,1579,43.65,32.41,33.93,1997,12,13
12/14/1997,5966,9016,2201,45.49,33.88,34.76,1997,12,14
12/15/1997,5777,8535,2026,46.19,34.86,35.34,1997,12,15
12/16/1997,5398,6547,1966,46.36,34.95,35.42,1997,12,16
12/17/1997,5686,9001,2145,47.03,35.56,35.58,1997,12,17
12/18/1997,6492,6661,2519,47.24,35.64,35.58,1997,12,18
12/19/1997,585,6661,2519,47.24,35.64,35.58,1997,12,19
12/20/1997,585,6822,2258,47.37,35.92,35.65,1997,12,20
12/21/1997,532,6336,2279,47.47,36.03,35.71,1997,12,21
12/22/1997,5177,6627,2283,47.59,36.03,35.71,1997,12,22
12/23/1997,517,5727,2525,47.59,36.03,35.71,1997,12,23
12/24/1997,4648,6704,2063,47.59,36.25,35.71,1997,12,24
12/25/1997,4844,5635,1851,47.59,36.25,35.71,1997,12,25
12/26/1997,4140,5196,1668,47.59,36.25,35.71,1997,12,26
12/27/1997,5148,4288,2399,47.59,36.25,35.71,1997,12,27
12/28/1997,4483,5007,1495,47.59,36.25,35.71,1997,12,28
12/29/1997,4764,5796,866,47.59,36.25,35.71,1997,12,29
12/30/1997,3984,5208,1306,47.59,36.25,35.71,1997,12,30
12/31/1997,3802,6191,1493,47.59,36.25,35.71,1997,12,31
1/1/1998,2913,6967,1159,48.06,36.41,35.71,1998,1,1
1/2/1998,4280,13041,1501,51.09,38.65,38.1,1998,1,2
1/3/1998,8851,19699,2075,54.61,41.02,40.29,1998,1,3
1/4/1998,9854,20135,3586,55.98,42.68,43.35,1998,1,4
1/5/1998,5914,13793,2945,56.82,42.72,43.84,1998,1,5
1/6/1998,5555,13003,2816,57.3,43.1,44.16,1998,1,6
1/7/1998,3880,11714,2671,57.88,44.37,45.08,1998,1,7
1/8/1998,3885,10569,2397,57.88,44.37,45.08,1998,1,8
1/9/1998,3576,10571,2355,58.51,44.51,45.57,1998,1,9
1/10/1998,7957,9016,2490,61.37,44.94,47.64,1998,1,10
1/11/1998,1808,18490,7478,65.74,46.48,51.42,1998,1,11
1/12/1998,34387,35901,22038,72.12,48.41,56.43,1998,1,12
1/13/1998,22297,29802,15048,73.41,49.29,58.81,1998,1,13
1/14/1998,15803,38629,7664,75.74,52.41,60.81,1998,1,14
1/15/1998,25724,38796,22383,79.6,54.87,65.22,1998,1,15
1/16/1998,20688,35573,21502,81.08,57.8,68.35,1998,1,16
1/17/1998,32902,49419,21185,82.34,59.21,70.25,1998,1,17
1/18/1998,27564,53476,16003,85.03,62,71.77,1998,1,18
1/19/1998,23339,48850,16214,86.96,63.27,74.67,1998,1,19
1/20/1998,16099,35881,9805,88.54,63.28,74.84,1998,1,20
1/21/1998,12050,26965,6497,88.54,63.42,74.88,1998,1,21
1/22/1998,10820,22652,5390,88.54,63.56,74.88,1998,1,22
1/23/1998,10021,19093,5180,88.69,63.86,74.88,1998,1,23
1/24/1998,9885,17876,4451,88.71,64.58,74.89,1998,1,24
1/25/1998,7235,17886,4458,89.29,65.48,74.89,1998,1,25
1/26/1998,10953,27845,3852,91.65,68.56,75.04,1998,1,26
1/27/1998,10661,33621,3480,92.2,70.37,75.23,1998,1,27
1/28/1998,896,25360,3087,92.2,70.41,75.23,1998,1,28
1/29/1998,13615,35423,5745,95.69,73.24,78.35,1998,1,29
1/30/1998,12884,29788,5162,96.35,74.09,78.96,1998,1,30
1/31/1998,11055,25831,4383,96.94,74.4,79.04,1998,1,31
2/1/1998,12700,41186,3862,99.14,78.09,80.61,1998,2,1
2/2/1998,17553,44191,9608,103.12,80.52,83.84,1998,2,2
2/3/1998,51742,77507,38927,110.6,86.49,88.89,1998,2,3
2/4/1998,29696,54971,19742,111.41,88.98,90.17,1998,2,4
2/5/1998,22424,59670,12160,113.59,92.71,91.65,1998,2,5
2/6/1998,29415,68375,14598,117.29,98.14,94.7,1998,2,6
2/7/1998,31580,76221,22857,119.92,102.62,99.06,1998,2,7
2/8/1998,25481,61074,23420,120.76,106.27,101.17,1998,2,8
2/9/1998,18847,39680,15000,122.31,106.41,101.46,1998,2,9
2/10/1998,15810,31044,11465,123.38,107.07,102.64,1998,2,10
2/11/1998,15867,25949,10995,125.37,108.87,104.23,1998,2,11
2/12/1998,14856,27722,10279,126.68,109.86,105.25,1998,2,12
2/13/1998,14274,32686,10514,127.12,111.37,106.26,1998,2,13
2/14/1998,18950,41844,15874,130.33,114.57,109.22,1998,2,14
2/15/1998,16805,33406,16283,130.86,115.2,110.82,1998,2,15
2/16/1998,13998,28953,12037,131.37,115.38,111.42,1998,2,16
2/17/1998,12968,26662,10461,132.92,115.76,111.83,1998,2,17
2/18/1998,11934,23720,9087,133.01,115.97,111.83,1998,2,18
2/19/1998,15370,41577,9307,136.08,119.86,113.76,1998,2,19
2/20/1998,14140,32718,11977,136.86,121.88,115.64,1998,2,20
2/21/1998,17085,43037,11467,141.3,127.43,117.82,1998,2,21
2/22/1998,15662,32407,13395,142,128.04,119.87,1998,2,22
2/23/1998,15486,28811,12281,144.85,129.51,121.07,1998,2,23
2/24/1998,14315,27194,11258,146.63,130.86,122.14,1998,2,24
2/25/1998,12168,23054,9496,146.68,130.91,122.21,1998,2,25
2/26/1998,11132,18976,7691,146.68,130.93,122.21,1998,2,26
2/27/1998,10404,17063,7573,146.69,130.93,122.26,1998,2,27
2/28/1998,9665,16342,6347,146.69,130.97,122.26,1998,2,28
3/1/1998,9596,16466,5962,146.69,131.08,122.26,1998,3,1
3/2/1998,9840,16412,6777,146.76,131.2,122.62,1998,3,2
3/3/1998,9596,17405,6937,146.95,131.45,122.89,1998,3,3
3/4/1998,9810,17813,6661,146.95,131.45,122.89,1998,3,4
3/5/1998,8637,16657,6296,147.52,131.47,123.87,1998,3,5
3/6/1998,9917,15795,6724,148.96,131.51,125.32,1998,3,6
3/7/1998,7497,14830,6074,149.02,131.51,125.4,1998,3,7
3/8/1998,8914,14249,6239,149.2,131.61,125.66,1998,3,8
3/9/1998,8097,13383,6523,149.2,131.61,125.66,1998,3,9
3/10/1998,7710,12512,5401,149.2,131.61,125.66,1998,3,10
3/11/1998,7745,13053,5670,149.2,131.61,125.66,1998,3,11
3/12/1998,7113,11368,5367,149.36,131.73,125.66,1998,3,12
3/13/1998,8506,15309,5588,149.78,133.34,126.09,1998,3,13
3/14/1998,8899,14659,5349,149.78,133.41,126.32,1998,3,14
3/15/1998,9395,16030,5669,149.8,133.41,126.32,1998,3,15
3/16/1998,11275,17199,6586,150.94,133.94,126.32,1998,3,16
3/17/1998,12140,17237,6798,150.94,133.94,126.32,1998,3,17
3/18/1998,10882,15982,7157,150.94,133.94,126.32,1998,3,18
3/19/1998,10384,15675,7446,150.94,133.94,126.32,1998,3,19
3/20/1998,11229,15593,7801,150.94,133.94,126.32,1998,3,20
3/21/1998,11178,18062,7760,151.69,134.33,126.48,1998,3,21
3/22/1998,22346,37543,8364,154.72,139.24,127.7,1998,3,22
3/23/1998,30317,64514,11189,158.04,142.26,129.78,1998,3,23
3/24/1998,45906,59668,25945,162.31,149.54,134.74,1998,3,24
3/25/1998,34347,35464,24176,163.19,150.29,137.18,1998,3,25
3/26/1998,27389,29264,15894,163.48,150.29,137.38,1998,3,26
3/27/1998,22426,24918,12777,164.45,150.48,138.43,1998,3,27
3/28/1998,19362,22446,11628,164.81,150.72,139.92,1998,3,28
3/29/1998,17588,20865,10184,164.81,150.73,140.38,1998,3,29
3/30/1998,14840,18373,9573,165.02,150.73,140.38,1998,3,30
3/31/1998,15595,19210,9935,166.01,152.01,141.07,1998,3,31
4/1/1998,13749,17578,8751,166.66,152.28,141.42,1998,4,1
4/2/1998,12235,18984,8405,167.27,152.93,141.74,1998,4,2
4/3/1998,14037,20135,10075,168.95,153.4,143.41,1998,4,3
4/4/1998,12648,19015,7734,169.51,153.56,144.31,1998,4,4
4/5/1998,11319,19014,7734,170.19,153.56,145.51,1998,4,5
4/6/1998,11634,18617,8728,171.1,154.14,146.4,1998,4,6
4/7/1998,11541,17153,9460,171.67,154.54,147.22,1998,4,7
4/8/1998,10772,17972,8127,171.67,154.68,147.41,1998,4,8
4/9/1998,10690,18365,7981,172.07,155.28,147.85,1998,4,9
4/10/1998,9969,19595,8389,172.36,157.24,147.97,1998,4,10
4/11/1998,9794,20861,7692,172.74,157.65,148.66,1998,4,11
4/12/1998,10387,19462,7177,173.56,157.72,150.31,1998,4,12
4/13/1998,10140,18933,11392,175.81,158.77,153.39,1998,4,13
4/14/1998,11252,17870,11107,177.52,158.83,154.27,1998,4,14
4/15/1998,10466,16949,9656,177.62,159.11,154.31,1998,4,15
4/16/1998,10139,15844,8681,177.68,159.11,154.45,1998,4,16
4/17/1998,10404,13915,7927,177.68,159.11,154.45,1998,4,17
4/18/1998,9738,14700,7755,177.68,159.11,154.45,1998,4,18
4/19/1998,9806,13838,7993,177.68,159.11,154.45,1998,4,19
4/20/1998,10426,14085,8485,177.68,159.11,154.45,1998,4,20
4/21/1998,12178,14431,8843,177.68,159.11,154.45,1998,4,21
4/22/1998,13159,14881,9619,177.68,159.11,154.45,1998,4,22
4/23/1998,14851,15183,10470,178.09,159.22,155.36,1998,4,23
4/24/1998,16725,14785,11185,178.64,160.14,156.19,1998,4,24
4/25/1998,14719,13740,10254,178.64,160.14,156.19,1998,4,25
4/26/1998,13788,13855,9694,178.64,160.14,156.19,1998,4,26
4/27/1998,13677,14659,9549,178.64,160.14,156.19,1998,4,27
4/28/1998,13981,14848,9641,178.64,160.14,156.19,1998,4,28
4/29/1998,14884,15511,10550,178.64,160.14,156.19,1998,4,29
4/30/1998,16006,15713,10168,178.64,160.14,156.19,1998,4,30
5/1/1998,16903,16703,10871,179.89,160.24,156.86,1998,5,1
5/2/1998,19415,16346,12809,180.41,161.22,158.9,1998,5,2
5/3/1998,17902,16258,13079,180.54,161.39,159.96,1998,5,3
5/4/1998,15826,15012,12006,180.6,161.39,160.6,1998,5,4
5/5/1998,14689,14374,11295,180.81,161.63,161.61,1998,5,5
5/6/1998,15090,14506,11669,181.14,161.67,162.45,1998,5,6
5/7/1998,14714,15153,10703,181.15,161.8,162.63,1998,5,7
5/8/1998,14714,17667,10076,181.77,161.81,163.02,1998,5,8
5/9/1998,14714,17662,10375,182.2,161.86,163.33,1998,5,9
5/10/1998,14714,17470,9424,182.27,161.91,163.4,1998,5,10
5/11/1998,14714,18590,9076,182.91,161.97,163.68,1998,5,11
5/12/1998,14714,18940,9554,183.14,163.34,164.39,1998,5,12
5/13/1998,14714,18136,9949,184.04,163.39,165.77,1998,5,13
5/14/1998,14714,19211,9120,184.14,163.67,166.11,1998,5,14
5/15/1998,14714,19802,8394,184.14,163.71,166.22,1998,5,15
5/16/1998,14714,21840,8338,184.99,163.93,166.78,1998,5,16
5/17/1998,14714,20632,8034,185.09,163.98,167.32,1998,5,17
5/18/1998,14714,19571,7616,185.29,163.98,167.32,1998,5,18
5/19/1998,14714,20505,7341,185.29,163.98,167.32,1998,5,19
5/20/1998,14714,17909,7891,185.29,164.42,167.32,1998,5,20
5/21/1998,14714,17521,7428,185.29,164.44,167.32,1998,5,21
5/22/1998,14714,16557,8158,185.31,164.46,167.44,1998,5,22
5/23/1998,14714,15779,7235,185.31,164.57,167.44,1998,5,23
5/24/1998,14714,16300,7072,185.69,164.64,167.44,1998,5,24
5/25/1998,14714,17776,8375,187.63,165.48,169.26,1998,5,25
5/26/1998,14714,18272,9491,188.77,165.63,170.04,1998,5,26
5/27/1998,14714,19105,8733,189.89,166.2,170.73,1998,5,27
5/28/1998,14714,26358,9052,191.51,168.54,171.59,1998,5,28
5/29/1998,19650,31885,9886,193.03,171.22,173.08,1998,5,29
5/30/1998,17498,26962,8929,193.4,171.96,173.1,1998,5,30
5/31/1998,16189,23322,8227,193.4,171.96,173.1,1998,5,31
6/1/1998,16000,20368,8985,193.4,171.96,173.1,1998,6,1
6/2/1998,16135,20306,9274,193.4,171.96,173.1,1998,6,2
6/3/1998,16169,21189,9404,193.42,172.07,173.1,1998,6,3
6/4/1998,15322,18729,8201,193.62,172.27,173.1,1998,6,4
6/5/1998,15705,18337,8747,193.62,172.27,173.1,1998,6,5
6/6/1998,15640,17709,8807,193.67,172.27,173.14,1998,6,6
6/7/1998,15796,17132,11200,193.76,172.39,174.13,1998,6,7
6/8/1998,13078,16318,11293,193.93,172.7,175.1,1998,6,8
6/9/1998,2891,16741,10397,193.94,172.7,175.28,1998,6,9
6/10/1998,17305,17616,10568,194.49,172.72,175.6,1998,6,10
6/11/1998,13510,17677,11335,195.35,172.74,176.51,1998,6,11
6/12/1998,17699,18741,10450,195.64,172.87,176.74,1998,6,12
6/13/1998,18040,18519,12943,195.64,173.19,176.98,1998,6,13
6/14/1998,17224,17512,13009,195.64,173.19,176.98,1998,6,14
6/15/1998,16732,21846,13201,195.64,173.19,176.98,1998,6,15
6/16/1998,15055,17584,12901,195.64,173.19,176.98,1998,6,16
6/17/1998,14909,15481,12342,195.64,173.19,176.98,1998,6,17
6/18/1998,14078,16553,11384,195.64,173.19,176.98,1998,6,18
6/19/1998,14373,14717,10920,195.64,173.19,176.98,1998,6,19
6/20/1998,11763,14191,10648,195.64,173.19,176.98,1998,6,20
6/21/1998,13133,12838,11104,195.64,173.19,176.98,1998,6,21
6/22/1998,12885,13322,11724,195.64,173.19,176.98,1998,6,22
6/23/1998,11538,12678,11577,195.64,173.19,176.98,1998,6,23
6/24/1998,11763,12583,10653,195.64,173.19,176.98,1998,6,24
6/25/1998,11071,11861,10162,195.64,173.19,176.98,1998,6,25
6/26/1998,10742,11073,10126,195.64,173.19,176.98,1998,6,26
6/27/1998,10774,12761,9336,195.64,173.19,176.98,1998,6,27
6/28/1998,9871,9866,9287,195.64,173.19,176.98,1998,6,28
6/29/1998,8977,9653,9373,195.64,173.19,176.98,1998,6,29
6/30/1998,9369,10101,8641,195.64,173.19,176.98,1998,6,30
7/1/1998,9214,10593,8348,195.64,173.19,176.98,1998,7,1
7/2/1998,7910,9730,8192,195.64,173.19,176.98,1998,7,2
7/3/1998,8559,7711,7656,195.64,173.19,176.98,1998,7,3
7/4/1998,6351,9068,7164,195.64,173.19,176.98,1998,7,4
7/5/1998,7614,8175,7004,195.64,173.19,176.98,1998,7,5
7/6/1998,6842,9104,6968,195.64,173.19,176.98,1998,7,6
7/7/1998,7293,8543,6609,195.64,173.19,176.98,1998,7,7
7/8/1998,686,7744,6359,195.64,173.19,176.98,1998,7,8
7/9/1998,688,7318,5978,195.64,173.19,176.98,1998,7,9
7/10/1998,6147,7324,5870,195.64,173.19,176.98,1998,7,10
7/11/1998,6183,7309,6089,195.64,173.19,176.98,1998,7,11
7/12/1998,5230,6996,5811,195.64,173.19,176.98,1998,7,12
7/13/1998,5565,6471,5274,195.64,173.19,176.98,1998,7,13
7/14/1998,5668,6786,5024,195.64,173.19,176.98,1998,7,14
7/15/1998,5626,7138,4355,195.64,173.19,176.98,1998,7,15
7/16/1998,5318,5811,4726,195.64,173.19,176.98,1998,7,16
7/17/1998,4987,6476,4450,195.64,173.19,176.98,1998,7,17
7/18/1998,5259,6302,3921,195.64,173.19,176.98,1998,7,18
7/19/1998,5142,6554,4179,195.64,173.19,176.98,1998,7,19
7/20/1998,4732,6142,3950,195.64,173.19,176.98,1998,7,20
7/21/1998,4843,6132,3924,195.64,173.19,176.98,1998,7,21
7/22/1998,4578,6827,3607,195.64,173.19,176.98,1998,7,22
7/23/1998,5556,6263,3409,195.64,173.23,176.98,1998,7,23
7/24/1998,4230,7398,3927,195.64,173.27,176.98,1998,7,24
7/25/1998,5313,7398,3927,195.64,173.27,176.98,1998,7,25
7/26/1998,5028,6163,3268,195.64,173.27,176.98,1998,7,26
7/27/1998,4386,5201,3252,195.68,173.27,176.98,1998,7,27
7/28/1998,4258,5844,3450,195.68,173.27,176.98,1998,7,28
7/29/1998,4008,5294,2921,195.68,173.27,176.98,1998,7,29
7/30/1998,4086,5808,3403,195.68,173.27,176.98,1998,7,30
7/31/1998,4886,4273,2928,195.68,173.27,176.98,1998,7,31
8/1/1998,5231,5270,3382,195.68,173.27,176.98,1998,8,1
8/2/1998,4558,3902,3214,195.68,173.27,176.98,1998,8,2
8/3/1998,4154,6588,3064,195.68,173.27,176.98,1998,8,3
8/4/1998,4404,6223,3264,195.68,173.27,176.98,1998,8,4
8/5/1998,4684,6341,3837,195.68,173.27,176.98,1998,8,5
8/6/1998,4071,5174,2478,195.68,173.27,176.98,1998,8,6
8/7/1998,4099,6200,3102,195.68,173.27,176.98,1998,8,7
8/8/1998,3588,4752,2843,195.68,173.27,176.98,1998,8,8
8/9/1998,3850,5303,2086,195.68,173.27,176.98,1998,8,9
8/10/1998,4223,5151,2118,195.68,173.27,176.98,1998,8,10
8/11/1998,2860,5578,3057,195.68,173.27,176.98,1998,8,11
8/12/1998,4163,5733,3087,195.68,173.27,176.98,1998,8,12
8/13/1998,4686,5481,3484,195.68,173.27,176.98,1998,8,13
8/14/1998,2876,5867,3407,195.68,173.27,176.98,1998,8,14
8/15/1998,3187,5373,2594,195.68,173.27,176.98,1998,8,15
8/16/1998,3555,4515,2535,195.68,173.27,176.98,1998,8,16
8/17/1998,3393,3481,2422,195.68,173.36,176.98,1998,8,17
8/18/1998,3582,4816,2782,195.68,173.53,176.98,1998,8,18
8/19/1998,2937,4357,2977,195.68,173.53,176.98,1998,8,19
8/20/1998,3584,5181,2576,195.68,173.53,176.98,1998,8,20
8/21/1998,3868,6334,2861,195.68,173.53,176.98,1998,8,21
8/22/1998,3999,5845,3117,195.68,173.53,176.98,1998,8,22
8/23/1998,3037,4686,2980,195.68,173.53,176.98,1998,8,23
8/24/1998,3627,5409,3049,195.68,173.53,176.98,1998,8,24
8/25/1998,3429,3737,2952,195.68,173.53,176.98,1998,8,25
8/26/1998,3289,5110,2832,195.68,173.53,176.98,1998,8,26
8/27/1998,3897,3945,2964,195.68,173.53,176.98,1998,8,27
8/28/1998,3677,5195,2850,195.68,173.53,176.98,1998,8,28
8/29/1998,3828,5774,2673,195.68,173.53,176.98,1998,8,29
8/30/1998,3813,4074,2517,195.68,173.53,176.98,1998,8,30
8/31/1998,3894,4498,2984,195.68,173.53,176.98,1998,8,31
9/1/1998,3950,5601,3596,195.68,173.53,176.98,1998,9,1
9/2/1998,3599,5190,2948,195.68,173.53,176.98,1998,9,2
9/3/1998,3807,5889,2835,195.68,173.53,176.98,1998,9,3
9/4/1998,3807,4650,3188,195.68,173.53,176.98,1998,9,4
9/5/1998,3807,5094,2489,195.68,173.53,176.98,1998,9,5
9/6/1998,3807,4573,2746,195.68,173.53,176.98,1998,9,6
9/7/1998,3713,5591,3016,195.68,173.53,176.98,1998,9,7
9/8/1998,3314,4895,2509,195.68,173.53,176.98,1998,9,8
9/9/1998,3010,5522,2179,195.75,173.53,176.98,1998,9,9
9/10/1998,3142,5155,3163,195.75,173.53,176.98,1998,9,10
9/11/1998,3499,5295,2760,195.75,173.53,176.98,1998,9,11
9/12/1998,4043,4938,3096,195.75,173.53,176.98,1998,9,12
9/13/1998,3447,4790,3171,195.75,173.53,176.98,1998,9,13
9/14/1998,3914,5247,2222,195.75,173.53,176.98,1998,9,14
9/15/1998,4520,5408,2323,195.75,173.53,176.98,1998,9,15
9/16/1998,3582,5602,2100,195.75,173.53,176.98,1998,9,16
9/17/1998,2754,5356,2418,195.75,173.53,176.98,1998,9,17
9/18/1998,3359,4942,1793,195.75,173.53,176.98,1998,9,18
9/19/1998,3226,3216,2221,195.75,173.53,176.98,1998,9,19
9/20/1998,3942,3582,2109,195.75,173.53,176.98,1998,9,20
9/21/1998,2331,6099,2019,195.75,173.53,176.98,1998,9,21
9/22/1998,2636,6443,1966,195.75,173.53,176.98,1998,9,22
9/23/1998,2606,6489,1904,195.75,173.53,176.98,1998,9,23
9/24/1998,3783,7442,1972,195.75,173.53,176.98,1998,9,24
9/25/1998,1640,5094,1944,195.77,173.53,176.98,1998,9,25
9/26/1998,3323,1088,1633,196.99,173.57,176.98,1998,9,26
9/27/1998,2705,1765,1526,197.5,173.57,176.98,1998,9,27
9/28/1998,2628,3455,1608,197.51,173.73,176.98,1998,9,28
9/29/1998,2285,5826,1710,197.51,173.73,177.06,1998,9,29
9/30/1998,2918,5980,1453,197.56,173.73,177.1,1998,9,30
10/1/1998,2648,7861,691,0,0,0,1998,10,1
10/2/1998,3663,5645,602,0,0,0,1998,10,2
10/3/1998,3943,1955,912,0,0,0,1998,10,3
10/4/1998,3743,1725,1062,0,0,0,1998,10,4
10/5/1998,2762,5089,1187,0,0,0,1998,10,5
10/6/1998,2657,5478,1105,0,0,0,1998,10,6
10/7/1998,2516,6604,813,0,0,0,1998,10,7
10/8/1998,3011,7236,676,0.32,0.01,0,1998,10,8
10/9/1998,2665,7391,1165,0.32,0.01,0,1998,10,9
10/10/1998,2931,819,792,0.32,0.01,0,1998,10,10
10/11/1998,2980,1374,883,0.32,0.01,0,1998,10,11
10/12/1998,2218,3887,894,0.32,0.01,0,1998,10,12
10/13/1998,3308,3313,722,0.32,0.12,0,1998,10,13
10/14/1998,2760,5500,1188,0.32,0.12,0,1998,10,14
10/15/1998,2492,5777,619,0.32,0.12,0,1998,10,15
10/16/1998,2808,5087,863,0.32,0.12,0,1998,10,16
10/17/1998,3374,5693,1026,0.32,0.12,0,1998,10,17
10/18/1998,1936,5671,783,0.32,0.12,0,1998,10,18
10/19/1998,1597,5794,920,0.32,0.12,0,1998,10,19
10/20/1998,1318,5584,893,0.32,0.12,0,1998,10,20
10/21/1998,1464,5154,794,0.32,0.12,0,1998,10,21
10/22/1998,1276,5228,564,0.32,0.12,0,1998,10,22
10/23/1998,1553,6047,894,0.32,0.12,0,1998,10,23
10/24/1998,637,7070,1244,0.32,1.02,0,1998,10,24
10/25/1998,1900,4542,1165,0.32,1.48,0.82,1998,10,25
10/26/1998,1652,6232,772,0.98,1.48,0.82,1998,10,26
10/27/1998,2442,6071,947,0.98,1.48,0.82,1998,10,27
10/28/1998,1425,5319,953,0.98,1.48,0.82,1998,10,28
10/29/1998,1457,5712,477,1.03,1.48,0.82,1998,10,29
10/30/1998,3513,5778,869,1.05,1.48,0.82,1998,10,30
10/31/1998,4422,7523,1308,1.05,1.48,0.82,1998,10,31
11/1/1998,3609,6270,1205,1.15,1.48,1.5,1998,11,1
11/2/1998,3156,3688,1472,1.28,1.48,1.5,1998,11,2
11/3/1998,3042,3892,1354,1.28,1.5,1.5,1998,11,3
11/4/1998,2974,4854,1400,1.28,1.52,1.5,1998,11,4
11/5/1998,3100,5189,1485,1.68,1.52,1.64,1998,11,5
11/6/1998,3158,6441,1144,2.3,1.59,2.34,1998,11,6
11/7/1998,3978,10771,2117,5.14,1.69,4.98,1998,11,7
11/8/1998,3958,6506,1900,5.42,3.14,5.64,1998,11,8
11/9/1998,3042,6513,1287,5.53,3.14,5.74,1998,11,9
11/10/1998,3023,8543,1427,5.95,3.49,6.15,1998,11,10
11/11/1998,5332,6930,1354,5.97,4.55,6.59,1998,11,11
11/12/1998,4098,5372,1787,6.03,4.55,6.59,1998,11,12
11/13/1998,4214,4862,1036,6.03,4.55,6.59,1998,11,13
11/14/1998,3775,4488,868,6.03,4.55,6.59,1998,11,14
11/15/1998,3724,4585,920,6.03,4.55,6.63,1998,11,15
11/16/1998,3153,5419,1313,6.43,4.55,6.63,1998,11,16
11/17/1998,4418,7311,1915,7.44,4.55,8.57,1998,11,17
11/18/1998,4233,5357,1280,7.51,4.6,8.57,1998,11,18
11/19/1998,3750,4675,1538,7.51,4.6,8.57,1998,11,19
11/20/1998,3939,6608,1527,7.54,4.6,8.57,1998,11,20
11/21/1998,3795,11183,1613,9.13,4.92,9.76,1998,11,21
11/22/1998,6335,8409,2461,9.28,6.22,10.78,1998,11,22
11/23/1998,15274,25860,1921,15.11,8.86,13.61,1998,11,23
11/24/1998,10662,15738,3837,16.78,9.88,15.76,1998,11,24
11/25/1998,6707,13050,3110,16.78,10.11,15.76,1998,11,25
11/26/1998,6355,14506,2077,18.08,10.15,15.76,1998,11,26
11/27/1998,8016,13794,2264,19.64,10.73,16.58,1998,11,27
11/28/1998,7015,11932,2217,20.13,10.73,17.05,1998,11,28
11/29/1998,7778,15581,2268,22.37,11.86,20.24,1998,11,29
11/30/1998,22587,38668,5336,26.1,17.71,23.12,1998,11,30
12/1/1998,18757,30432,6169,27.77,19.73,26.1,1998,12,1
12/2/1998,11380,25694,4350,28.98,20.6,27.12,1998,12,2
12/3/1998,28397,34059,6052,31.24,22.33,29.51,1998,12,3
12/4/1998,16114,21944,6892,31.43,22.35,31.62,1998,12,4
12/5/1998,11715,30252,4362,32.49,22.6,32.25,1998,12,5
12/6/1998,10368,5791,3569,32.53,22.86,32.94,1998,12,6
12/7/1998,7977,13069,2708,32.78,22.96,33.02,1998,12,7
12/8/1998,8969,10293,3039,32.95,23.3,33.37,1998,12,8
12/9/1998,6103,10315,2566,32.95,23.33,33.37,1998,12,9
12/10/1998,7627,7928,2562,32.95,23.33,33.37,1998,12,10
12/11/1998,5508,9848,2748,32.95,23.33,33.37,1998,12,11
12/12/1998,6997,9460,2921,32.95,23.33,33.37,1998,12,12
12/13/1998,5628,9452,2414,33.42,23.45,33.81,1998,12,13
12/14/1998,6064,9758,2555,33.53,24.15,34.49,1998,12,14
12/15/1998,4982,8285,2824,33.53,24.15,34.49,1998,12,15
12/16/1998,2993,10125,2772,33.53,24.15,34.49,1998,12,16
12/17/1998,4367,9816,3080,33.53,24.15,34.49,1998,12,17
12/18/1998,5395,8520,3312,33.53,24.15,34.49,1998,12,18
12/19/1998,6129,6584,2856,33.64,24.15,34.53,1998,12,19
12/20/1998,5499,7304,3222,33.86,24.3,35.26,1998,12,20
12/21/1998,5373,8714,3397,34.25,24.3,35.59,1998,12,21
12/22/1998,4365,7888,3287,34.25,24.3,35.59,1998,12,22
12/23/1998,4842,7730,3182,34.25,24.3,35.59,1998,12,23
12/24/1998,5054,6708,2913,34.25,24.3,35.59,1998,12,24
12/25/1998,5589,7575,2991,34.25,24.3,35.59,1998,12,25
12/26/1998,5250,7409,2339,34.25,24.3,35.59,1998,12,26
12/27/1998,5060,6940,2135,34.25,24.3,35.59,1998,12,27
12/28/1998,4435,7099,2238,34.25,24.3,35.59,1998,12,28
12/29/1998,5009,5839,1861,34.25,24.3,35.59,1998,12,29
12/30/1998,5297,5671,2297,34.25,24.3,35.59,1998,12,30
12/31/1998,4591,4772,2049,34.3,24.41,35.63,1998,12,31
1/1/1999,4685,5570,1699,34.3,24.41,35.63,1999,1,1
1/2/1999,4452,5415,1433,34.3,24.41,35.63,1999,1,2
1/3/1999,2958,7543,2212,34.3,24.41,35.63,1999,1,3
1/4/1999,4507,5060,1889,34.3,24.41,35.63,1999,1,4
1/5/1999,4181,5721,1734,34.3,24.41,35.63,1999,1,5
1/6/1999,3486,7080,2482,34.3,24.41,35.63,1999,1,6
1/7/1999,3592,7907,1707,34.3,24.41,35.63,1999,1,7
1/8/1999,3732,6591,1800,34.3,24.41,35.63,1999,1,8
1/9/1999,3305,5975,1958,34.3,24.41,35.63,1999,1,9
1/10/1999,2643,4713,1438,34.3,24.41,35.63,1999,1,10
1/11/1999,3743,5411,1197,34.3,24.41,35.63,1999,1,11
1/12/1999,3650,4997,1796,34.3,24.41,35.63,1999,1,12
1/13/1999,3743,5616,1616,34.3,24.41,35.63,1999,1,13
1/14/1999,3118,6078,1470,34.49,24.41,35.82,1999,1,14
1/15/1999,4369,6430,1756,35.57,24.51,37.47,1999,1,15
1/16/1999,5463,6025,2188,35.89,25.54,39.38,1999,1,16
1/17/1999,6644,12645,2947,38.37,27.32,41.8,1999,1,17
1/18/1999,13630,19366,6178,39.71,29.67,45.05,1999,1,18
1/19/1999,13963,20809,13546,43.91,30.44,51.34,1999,1,19
1/20/1999,21727,26018,27874,47.24,32.31,56.2,1999,1,20
1/21/1999,18630,21175,19827,48.14,32.88,58.2,1999,1,21
1/22/1999,14259,25273,10677,51.27,34.12,60.14,1999,1,22
1/23/1999,28203,29447,18103,54.47,36.14,63.91,1999,1,23
1/24/1999,17141,20637,14109,54.8,36.27,65.07,1999,1,24
1/25/1999,12384,16444,9210,56.27,36.27,65.11,1999,1,25
1/26/1999,12384,15222,7797,56.92,36.68,65.75,1999,1,26
1/27/1999,9952,13155,6498,56.97,36.71,65.89,1999,1,27
1/28/1999,8169,11854,5630,56.97,36.71,65.89,1999,1,28
1/29/1999,6664,11946,4892,56.97,36.71,65.89,1999,1,29
1/30/1999,6454,11011,4634,56.97,36.71,65.89,1999,1,30
1/31/1999,6069,9977,4852,57.84,37.05,66.75,1999,1,31
2/1/1999,6170,8960,4451,58.12,37.11,67.32,1999,2,1
2/2/1999,6165,9502,4518,58.12,37.11,67.32,1999,2,2
2/3/1999,7183,7944,4432,58.12,37.11,67.32,1999,2,3
2/4/1999,6784,8359,4027,58.12,37.14,67.44,1999,2,4
2/5/1999,5961,10522,4146,58.12,37.14,67.45,1999,2,5
2/6/1999,8833,21691,5285,60.98,40.95,70.28,1999,2,6
2/7/1999,21180,40214,20061,65.13,46.07,76.24,1999,2,7
2/8/1999,21280,25899,21876,70.64,46.45,81.01,1999,2,8
2/9/1999,54255,42170,48115,78.71,47.94,86.19,1999,2,9
2/10/1999,30115,28006,25267,79.5,47.95,88.44,1999,2,10
2/11/1999,21455,22193,15120,79.5,47.95,88.44,1999,2,11
2/12/1999,17374,20012,11751,79.5,47.95,88.44,1999,2,12
2/13/1999,13447,17475,10336,79.61,48.07,88.56,1999,2,13
2/14/1999,11421,17273,9012,79.96,48.42,88.72,1999,2,14
2/15/1999,11140,15327,7830,79.96,48.42,88.72,1999,2,15
2/16/1999,13195,18630,8462,82.81,49.66,92.16,1999,2,16
2/17/1999,21150,19081,22376,84.51,51.58,94.72,1999,2,17
2/18/1999,18677,21199,15676,86.13,52.58,95.59,1999,2,18
2/19/1999,29903,19797,15088,87.68,53.13,96.41,1999,2,19
2/20/1999,18527,22250,12798,89.47,53.71,97.78,1999,2,20
2/21/1999,24752,22520,17058,90.94,55.73,101.2,1999,2,21
2/22/1999,15638,20443,12570,92.13,56.62,101.41,1999,2,22
2/23/1999,13598,22441,9797,92.31,57.25,101.41,1999,2,23
2/24/1999,13038,22203,9391,93.14,57.81,101.64,1999,2,24
2/25/1999,15970,29612,10246,95.35,60.03,103.77,1999,2,25
2/26/1999,13492,24188,9490,96.15,60.27,104.09,1999,2,26
2/27/1999,11461,21457,8674,96.3,60.74,104.09,1999,2,27
2/28/1999,18968,30419,8865,99.22,61.66,106.05,1999,2,28
3/1/1999,24752,29864,13836,100.56,61.99,107.66,1999,3,1
3/2/1999,20314,26698,12586,101.51,62.01,107.74,1999,3,2
3/3/1999,24558,25911,15236,103.59,62.93,109.97,1999,3,3
3/4/1999,21366,24650,14124,103.6,62.93,110.17,1999,3,4
3/5/1999,17625,21261,11687,103.6,62.93,110.17,1999,3,5
3/6/1999,14435,20781,9981,103.6,62.95,110.17,1999,3,6
3/7/1999,13789,18826,8987,103.6,62.98,110.17,1999,3,7
3/8/1999,11480,20471,8513,104.52,64.14,111.19,1999,3,8
3/9/1999,12892,18385,10051,106.44,66.95,112.94,1999,3,9
3/10/1999,10288,14253,9273,106.62,67.01,112.96,1999,3,10
3/11/1999,9089,16144,8504,106.62,67.01,112.96,1999,3,11
3/12/1999,9089,15632,6897,106.62,67.01,112.96,1999,3,12
3/13/1999,8306,14588,6864,106.62,67.01,112.96,1999,3,13
3/14/1999,9177,13555,6953,106.64,67.05,112.96,1999,3,14
3/15/1999,8857,13789,6285,106.64,67.21,112.96,1999,3,15
3/16/1999,8537,13408,6306,106.64,67.21,112.96,1999,3,16
3/17/1999,8410,13056,6259,106.64,67.21,112.96,1999,3,17
3/18/1999,8328,12865,6103,106.64,67.21,112.96,1999,3,18
3/19/1999,8866,12879,6938,106.64,67.21,112.96,1999,3,19
3/20/1999,8752,13453,6688,107,67.74,113.55,1999,3,20
3/21/1999,8779,13896,6381,107.58,68.08,114.11,1999,3,21
3/22/1999,8518,12772,6171,107.73,68.44,114.26,1999,3,22
3/23/1999,8069,12836,5637,108.05,69.15,114.54,1999,3,23
3/24/1999,8620,22584,6170,108.91,71.25,114.62,1999,3,24
3/25/1999,9399,26226,6286,109.26,74.15,114.66,1999,3,25
3/26/1999,9344,19517,5476,109.26,74.16,114.66,1999,3,26
3/27/1999,9183,17905,5770,109.26,74.16,114.66,1999,3,27
3/28/1999,8206,16438,6201,109.26,74.16,114.66,1999,3,28
3/29/1999,8124,14355,6179,109.4,74.16,114.81,1999,3,29
3/30/1999,8609,15146,5261,110.18,74.84,115.7,1999,3,30
3/31/1999,8094,14211,6009,111.25,75,117.5,1999,3,31
4/1/1999,9344,12749,5694,111.45,75.03,117.57,1999,4,1
4/2/1999,7710,13452,5281,111.46,75.03,117.57,1999,4,2
4/3/1999,7242,12708,4957,111.46,75.12,117.84,1999,4,3
4/4/1999,6728,11203,4269,111.52,75.15,118.13,1999,4,4
4/5/1999,6728,13609,5815,113.35,75.94,119.56,1999,4,5
4/6/1999,7434,11433,5713,114.34,76.78,120.87,1999,4,6
4/7/1999,6751,12012,5552,114.59,76.78,121.1,1999,4,7
4/8/1999,8427,16924,5763,116.8,78.68,122.93,1999,4,8
4/9/1999,8427,14227,6203,117.8,78.81,124.6,1999,4,9
4/10/1999,8427,15943,5966,118.5,79.15,124.87,1999,4,10
4/11/1999,8308,13744,6248,119.33,80.51,125.24,1999,4,11
4/12/1999,8169,14093,6718,119.39,80.51,125.24,1999,4,12
4/13/1999,8365,13423,6279,119.39,80.51,125.24,1999,4,13
4/14/1999,8616,11735,7505,119.39,80.51,125.24,1999,4,14
4/15/1999,8774,13008,7410,119.39,80.51,125.24,1999,4,15
4/16/1999,9078,13161,7454,119.39,80.51,125.24,1999,4,16
4/17/1999,9254,13214,8019,119.39,80.51,125.24,1999,4,17
4/18/1999,10317,13102,7934,119.39,80.51,125.24,1999,4,18
4/19/1999,11620,13888,8264,119.39,80.51,125.24,1999,4,19
4/20/1999,11370,14957,9161,119.39,80.51,125.24,1999,4,20
4/21/1999,11934,13445,7979,119.39,80.51,125.24,1999,4,21
4/22/1999,11497,13168,7441,119.4,80.55,125.24,1999,4,22
4/23/1999,11208,12258,7584,119.4,80.55,125.24,1999,4,23
4/24/1999,10948,14851,7141,119.4,80.55,125.24,1999,4,24
4/25/1999,11054,12738,6319,119.4,80.55,125.24,1999,4,25
4/26/1999,11054,13430,7566,119.67,80.64,125.56,1999,4,26
4/27/1999,12579,12378,7892,119.72,80.64,125.6,1999,4,27
4/28/1999,9064,11528,7102,120.44,80.67,125.6,1999,4,28
4/29/1999,10805,10987,6600,120.46,80.67,125.6,1999,4,29
4/30/1999,9530,11845,6289,120.46,80.67,125.6,1999,4,30
5/1/1999,10725,11689,5819,120.46,80.67,125.6,1999,5,1
5/2/1999,10734,13450,6849,120.86,80.72,126.62,1999,5,2
5/3/1999,10734,12116,7829,121.04,81.08,129.49,1999,5,3
5/4/1999,10289,11658,6757,121.08,81.08,130.11,1999,5,4
5/5/1999,9395,11374,6290,121.08,81.08,130.11,1999,5,5
5/6/1999,9881,11533,5702,121.08,81.08,130.11,1999,5,6
5/7/1999,9881,11946,6937,121.08,81.08,130.11,1999,5,7
5/8/1999,9347,11017,7631,121.08,81.08,130.11,1999,5,8
5/9/1999,9051,9840,6691,121.08,81.08,130.11,1999,5,9
5/10/1999,8623,10264,7236,121.08,81.08,130.11,1999,5,10
5/11/1999,8740,9999,6736,121.08,81.08,130.11,1999,5,11
5/12/1999,8678,9679,7879,121.08,81.08,130.11,1999,5,12
5/13/1999,8648,9716,8069,121.08,81.08,130.11,1999,5,13
5/14/1999,8648,9919,7826,121.08,81.14,130.11,1999,5,14
5/15/1999,8213,8816,6597,121.08,81.14,130.11,1999,5,15
5/16/1999,8161,9371,6486,121.08,81.14,130.11,1999,5,16
5/17/1999,7648,9315,6784,121.08,81.14,130.11,1999,5,17
5/18/1999,8163,8244,7275,121.08,81.14,130.11,1999,5,18
5/19/1999,7768,8922,6556,121.08,81.14,130.11,1999,5,19
5/20/1999,8348,9872,5718,121.08,81.14,130.11,1999,5,20
5/21/1999,8082,10442,5543,121.08,81.14,130.11,1999,5,21
5/22/1999,8592,7543,6180,121.08,81.14,130.11,1999,5,22
5/23/1999,8765,10327,7794,121.08,81.14,130.11,1999,5,23
5/24/1999,9280,9014,8231,121.08,81.14,130.11,1999,5,24
5/25/1999,8691,10205,9267,121.09,81.14,130.11,1999,5,25
5/26/1999,8965,9648,9542,121.1,81.14,130.11,1999,5,26
5/27/1999,9134,8798,8750,121.1,81.14,130.11,1999,5,27
5/28/1999,8474,8810,8329,121.1,81.14,130.11,1999,5,28
5/29/1999,7130,9953,7619,121.1,81.28,130.11,1999,5,29
5/30/1999,7004,7752,6676,121.1,81.36,130.11,1999,5,30
5/31/1999,6781,8289,7006,121.1,81.36,130.11,1999,5,31
6/1/1999,6229,8466,7078,121.1,81.4,130.11,1999,6,1
6/2/1999,6056,8019,5240,121.36,81.45,130.69,1999,6,2
6/3/1999,5859,7682,5590,121.81,82.04,131.18,1999,6,3
6/4/1999,4876,7864,5036,121.84,82.05,131.22,1999,6,4
6/5/1999,5567,8679,4540,121.84,82.05,131.24,1999,6,5
6/6/1999,5240,7908,4402,121.84,82.05,131.24,1999,6,6
6/7/1999,4204,7117,4785,121.84,82.05,131.24,1999,6,7
6/8/1999,4978,7302,4557,121.84,82.05,131.24,1999,6,8
6/9/1999,4016,6701,5334,121.84,82.05,131.24,1999,6,9
6/10/1999,4302,7171,5468,121.84,82.05,131.24,1999,6,10
6/11/1999,4710,7451,5254,121.84,82.05,131.24,1999,6,11
6/12/1999,5598,6845,4692,121.84,82.05,131.24,1999,6,12
6/13/1999,4602,6250,4808,121.84,82.05,131.24,1999,6,13
6/14/1999,5072,6854,4862,121.84,82.05,131.24,1999,6,14
6/15/1999,4078,7588,5686,121.84,82.05,131.24,1999,6,15
6/16/1999,4553,6004,5426,121.84,82.05,131.24,1999,6,16
6/17/1999,5654,6566,4820,121.84,82.05,131.24,1999,6,17
6/18/1999,3982,7091,5046,121.84,82.05,131.24,1999,6,18
6/19/1999,4935,4379,4072,121.84,82.05,131.24,1999,6,19
6/20/1999,3801,5362,3688,121.84,82.05,131.24,1999,6,20
6/21/1999,4171,5301,4264,121.84,82.05,131.24,1999,6,21
6/22/1999,3869,6059,4651,121.84,82.05,131.24,1999,6,22
6/23/1999,4228,5848,4286,121.84,82.05,131.24,1999,6,23
6/24/1999,3753,5945,4361,121.84,82.05,131.24,1999,6,24
6/25/1999,3753,5855,4147,121.84,82.05,131.24,1999,6,25
6/26/1999,4343,4609,4181,121.84,82.05,131.24,1999,6,26
6/27/1999,2852,4760,3318,121.84,82.05,131.24,1999,6,27
6/28/1999,3725,6303,3266,121.84,82.05,131.24,1999,6,28
6/29/1999,3623,5066,3441,121.84,82.05,131.24,1999,6,29
6/30/1999,3760,5852,3327,121.84,82.05,131.24,1999,6,30
7/1/1999,4202,4911,3336,121.84,82.05,131.24,1999,7,1
7/2/1999,2313,5526,2737,121.84,82.05,131.24,1999,7,2
7/3/1999,1890,3797,2383,121.84,82.05,131.24,1999,7,3
7/4/1999,2689,5165,1794,121.84,82.05,131.24,1999,7,4
7/5/1999,3575,5375,2093,121.84,82.05,131.24,1999,7,5
7/6/1999,3167,4425,2609,121.84,82.05,131.24,1999,7,6
7/7/1999,3167,4540,2191,121.84,82.05,131.24,1999,7,7
7/8/1999,3230,4871,2365,121.84,82.05,131.24,1999,7,8
7/9/1999,2768,4871,2365,121.84,82.05,131.24,1999,7,9
7/10/1999,3337,6146,2537,121.84,82.05,131.24,1999,7,10
7/11/1999,3268,5695,2132,121.84,82.05,131.24,1999,7,11
7/12/1999,3685,6284,3116,121.84,82.05,131.24,1999,7,12
7/13/1999,3248,5228,2749,121.84,82.05,131.67,1999,7,13
7/14/1999,3388,3983,2365,121.84,82.05,131.67,1999,7,14
7/15/1999,3388,5364,2134,121.84,82.05,131.67,1999,7,15
7/16/1999,2399,3945,1491,121.84,82.05,131.67,1999,7,16
7/17/1999,3499,3070,1865,121.84,82.05,131.67,1999,7,17
7/18/1999,2046,4942,1551,121.84,82.05,131.67,1999,7,18
7/19/1999,2593,3441,1731,121.84,82.05,131.67,1999,7,19
7/20/1999,2592,5329,1856,121.84,82.05,131.67,1999,7,20
7/21/1999,2757,5726,1864,121.84,82.05,131.67,1999,7,21
7/22/1999,2142,5920,1849,121.84,82.05,131.67,1999,7,22
7/23/1999,2169,4272,2174,121.84,82.05,131.67,1999,7,23
7/24/1999,2164,3132,1717,121.84,82.05,131.67,1999,7,24
7/25/1999,2234,3543,1589,121.84,82.05,131.67,1999,7,25
7/26/1999,3653,5749,2173,121.84,82.05,131.67,1999,7,26
7/27/1999,3248,5424,1446,121.84,82.05,131.67,1999,7,27
7/28/1999,2535,5829,2073,121.84,82.05,131.67,1999,7,28
7/29/1999,2768,5862,2067,121.84,82.05,131.67,1999,7,29
7/30/1999,3028,5304,1973,121.84,82.05,131.67,1999,7,30
7/31/1999,2627,2661,2187,121.84,82.05,131.67,1999,7,31
8/1/1999,3412,3878,1745,121.84,82.05,131.67,1999,8,1
8/2/1999,3412,5519,2039,121.84,82.05,131.67,1999,8,2
8/3/1999,3038,4982,2088,121.84,82.05,131.67,1999,8,3
8/4/1999,3192,3913,2193,121.84,82.05,131.67,1999,8,4
8/5/1999,2437,4211,2630,121.84,82.05,131.67,1999,8,5
8/6/1999,4367,4211,1766,121.87,82.05,131.67,1999,8,6
8/7/1999,4358,2669,2808,121.89,82.19,131.67,1999,8,7
8/8/1999,4364,3907,1597,121.89,82.19,131.67,1999,8,8
8/9/1999,3517,5500,1594,121.89,82.19,131.67,1999,8,9
8/10/1999,2708,5275,2230,122.63,82.25,131.84,1999,8,10
8/11/1999,2648,4635,2263,122.92,82.25,131.84,1999,8,11
8/12/1999,3291,4881,3117,122.92,82.25,131.84,1999,8,12
8/13/1999,3092,4548,2497,122.92,82.26,131.84,1999,8,13
8/14/1999,2924,3040,2670,122.92,82.26,131.84,1999,8,14
8/15/1999,2675,5160,2547,122.92,82.26,131.84,1999,8,15
8/16/1999,2537,5756,2327,122.92,82.26,131.84,1999,8,16
8/17/1999,3025,5161,2326,122.92,82.26,131.84,1999,8,17
8/18/1999,1582,4070,2270,122.92,82.26,131.84,1999,8,18
8/19/1999,3263,4665,3137,122.92,82.26,131.84,1999,8,19
8/20/1999,3420,5429,2203,122.92,82.26,131.84,1999,8,20
8/21/1999,3145,3569,2765,122.92,82.26,131.84,1999,8,21
8/22/1999,3005,5154,1951,122.92,82.26,131.84,1999,8,22
8/23/1999,2171,5033,1926,123.11,82.28,131.84,1999,8,23
8/24/1999,2757,4712,2250,123.11,82.28,131.84,1999,8,24
8/25/1999,-1515,4047,2538,123.11,82.28,131.84,1999,8,25
8/26/1999,3043,4048,2576,123.11,82.28,131.84,1999,8,26
8/27/1999,3648,4776,1953,123.18,82.28,132.11,1999,8,27
8/28/1999,3635,3297,2173,123.18,82.35,132.11,1999,8,28
8/29/1999,1888,2055,1850,123.18,82.35,132.11,1999,8,29
8/30/1999,4831,3756,1811,123.2,82.46,132.11,1999,8,30
8/31/1999,1703,3340,2316,123.2,82.51,132.11,1999,8,31
9/1/1999,1515,4141,2278,123.2,82.51,132.11,1999,9,1
9/2/1999,1078,4028,2332,123.2,82.51,132.11,1999,9,2
9/3/1999,1352,4315,2470,123.2,82.51,132.11,1999,9,3
9/4/1999,1691,4690,2109,123.2,82.51,132.11,1999,9,4
9/5/1999,2044,5652,2298,123.2,82.51,132.11,1999,9,5
9/6/1999,1824,4790,1999,123.2,82.51,132.11,1999,9,6
9/7/1999,2189,4822,1905,123.2,82.51,132.11,1999,9,7
9/8/1999,1082,4635,1968,123.2,82.51,132.11,1999,9,8
9/9/1999,1642,4568,1851,123.2,82.51,132.11,1999,9,9
9/10/1999,1568,4351,1651,123.4,82.51,132.11,1999,9,10
9/11/1999,1614,4132,1853,123.57,82.51,132.11,1999,9,11
9/12/1999,2486,3321,1896,123.57,82.51,132.11,1999,9,12
9/13/1999,1505,4790,1781,123.57,82.51,132.11,1999,9,13
9/14/1999,2316,4596,2269,123.57,82.51,132.11,1999,9,14
9/15/1999,1625,4737,2233,123.57,82.51,132.11,1999,9,15
9/16/1999,1720,3910,1799,123.57,82.51,132.11,1999,9,16
9/17/1999,2018,4117,1919,123.57,82.51,132.11,1999,9,17
9/18/1999,1245,3213,2166,123.57,82.51,132.11,1999,9,18
9/19/1999,2356,3123,2084,123.57,82.51,132.31,1999,9,19
9/20/1999,1572,3697,1813,123.57,82.51,132.31,1999,9,20
9/21/1999,1282,5675,1494,123.57,82.51,132.31,1999,9,21
9/22/1999,1704,6060,1749,123.57,82.51,132.31,1999,9,22
9/23/1999,1488,4307,1684,123.57,82.51,132.31,1999,9,23
9/24/1999,2078,4669,1446,123.57,82.51,132.31,1999,9,24
9/25/1999,1049,4851,1507,123.57,82.51,132.31,1999,9,25
9/26/1999,2300,4685,1384,123.57,82.51,132.31,1999,9,26
9/27/1999,1562,3951,1390,123.57,82.51,132.31,1999,9,27
9/28/1999,2115,4375,1674,123.57,82.51,132.31,1999,9,28
9/29/1999,1930,4932,1554,123.57,82.51,132.31,1999,9,29
9/30/1999,2053,4826,1518,123.57,82.51,132.31,1999,9,30
10/1/1999,1916,4015,2236,0,0,0,1999,10,1
10/2/1999,1173,2454,1680,0,0,0,1999,10,2
10/3/1999,1752,2022,718,0,0,0,1999,10,3
10/4/1999,1168,4385,1098,0,0,0,1999,10,4
10/5/1999,512,4237,1315,0,0,0,1999,10,5
10/6/1999,1019,5373,1495,0.09,0.27,0.14,1999,10,6
10/7/1999,1422,4304,1306,0.21,0.28,0.14,1999,10,7
10/8/1999,1014,4525,1317,0.21,0.28,0.14,1999,10,8
10/9/1999,562,4933,1328,0.21,0.28,0.14,1999,10,9
10/10/1999,1189,4221,1393,0.21,0.28,0.14,1999,10,10
10/11/1999,1037,4976,1647,0.21,0.28,0.14,1999,10,11
10/12/1999,1352,3552,1348,0.21,0.28,0.14,1999,10,12
10/13/1999,1868,3769,1237,0.21,0.28,0.14,1999,10,13
10/14/1999,541,2540,987,0.21,0.28,0.14,1999,10,14
10/15/1999,911,3861,948,0.21,0.28,0.14,1999,10,15
10/16/1999,2782,4689,1427,0.21,0.28,0.14,1999,10,16
10/17/1999,3282,7905,1529,0.21,0.28,0.14,1999,10,17
10/18/1999,3032,4332,1048,0.21,0.28,0.14,1999,10,18
10/19/1999,2991,3215,1130,0.21,0.28,0.14,1999,10,19
10/20/1999,2677,3851,1075,0.21,0.28,0.14,1999,10,20
10/21/1999,3020,4478,1068,0.21,0.28,0.14,1999,10,21
10/22/1999,3666,4723,982,0.21,0.28,0.14,1999,10,22
10/23/1999,3018,4784,918,0.21,0.28,0.14,1999,10,23
10/24/1999,2673,4492,1377,0.21,0.28,0.14,1999,10,24
10/25/1999,2521,4985,1059,0.21,0.28,0.14,1999,10,25
10/26/1999,2866,4542,990,0.21,0.35,0.14,1999,10,26
10/27/1999,4515,5319,1110,3.93,1.3,2.5,1999,10,27
10/28/1999,5030,8441,1588,7.83,3.8,5.45,1999,10,28
10/29/1999,3526,6536,1395,7.83,3.8,5.45,1999,10,29
10/30/1999,3581,7651,1281,7.83,3.8,5.45,1999,10,30
10/31/1999,2630,6976,1190,7.83,3.8,5.45,1999,10,31
11/1/1999,3590,5176,1166,7.83,3.8,5.45,1999,11,1
11/2/1999,3258,5255,1067,7.83,3.8,5.45,1999,11,2
11/3/1999,3600,4184,937,7.83,3.8,5.45,1999,11,3
11/4/1999,3393,4141,954,7.83,3.8,5.45,1999,11,4
11/5/1999,3072,3568,890,7.83,3.8,5.45,1999,11,5
11/6/1999,2071,2898,997,7.83,3.8,5.45,1999,11,6
11/7/1999,3739,3162,1232,8.9,3.8,6.36,1999,11,7
11/8/1999,4458,4650,1203,12.93,5.92,9.14,1999,11,8
11/9/1999,3524,4837,784,12.93,6.02,9.19,1999,11,9
11/10/1999,3813,9249,1156,13.13,7.3,9.23,1999,11,10
11/11/1999,2147,7365,1235,13.16,9.06,9.23,1999,11,11
11/12/1999,3379,5663,1120,13.16,9.07,9.23,1999,11,12
11/13/1999,2347,5809,1281,13.16,9.07,9.23,1999,11,13
11/14/1999,2966,4730,1306,13.16,9.07,9.23,1999,11,14
11/15/1999,3632,6591,1583,13.83,10.03,9.91,1999,11,15
11/16/1999,3961,5715,2288,15.05,11.18,10.78,1999,11,16
11/17/1999,3972,5966,2022,17.14,12.06,12.69,1999,11,17
11/18/1999,3694,5525,1552,17.22,12.07,12.69,1999,11,18
11/19/1999,4644,7366,2574,19.78,13.1,14.26,1999,11,19
11/20/1999,5376,6993,1758,21.43,14.8,15.78,1999,11,20
11/21/1999,4062,5389,2505,21.68,14.81,16.03,1999,11,21
11/22/1999,2768,5226,2520,22.38,14.81,16.03,1999,11,22
11/23/1999,3775,5090,2754,22.38,14.81,16.03,1999,11,23
11/24/1999,3125,5033,2076,22.38,14.81,16.03,1999,11,24
11/25/1999,2883,5242,1504,22.38,14.81,16.03,1999,11,25
11/26/1999,1965,5017,1493,22.38,14.85,16.03,1999,11,26
11/27/1999,2802,5333,1444,22.44,14.85,16.03,1999,11,27
11/28/1999,3180,5012,1292,22.44,14.86,16.03,1999,11,28
11/29/1999,3368,7308,2128,22.74,15.05,16.08,1999,11,29
11/30/1999,4660,8768,2280,25.71,19.28,18.16,1999,11,30
12/1/1999,4163,7230,1980,26.55,20.42,19.33,1999,12,1
12/2/1999,3793,7460,2639,26.86,20.85,19.72,1999,12,2
12/3/1999,2910,6312,1930,26.86,20.96,20.12,1999,12,3
12/4/1999,3694,5672,2366,26.86,20.96,20.12,1999,12,4
12/5/1999,3569,6411,2116,26.86,20.96,20.12,1999,12,5
12/6/1999,3047,6313,1905,26.86,20.96,20.12,1999,12,6
12/7/1999,3448,6177,1607,26.98,21.08,20.29,1999,12,7
12/8/1999,2924,6028,2247,27.13,21.09,20.48,1999,12,8
12/9/1999,3590,6312,2119,28.45,21.89,20.98,1999,12,9
12/10/1999,3177,4863,2338,28.99,22.1,21.29,1999,12,10
12/11/1999,3373,5359,1212,28.99,22.1,21.34,1999,12,11
12/12/1999,3185,5119,1571,29.06,22.1,21.43,1999,12,12
12/13/1999,3264,5877,1768,29.67,22.35,21.9,1999,12,13
12/14/1999,1860,5747,245,29.67,22.35,21.9,1999,12,14
12/15/1999,2818,5781,2276,29.67,22.35,21.9,1999,12,15
12/16/1999,2263,5320,5767,29.67,22.35,21.9,1999,12,16
12/17/1999,2532,5790,2137,29.67,22.35,21.9,1999,12,17
12/18/1999,2029,5052,933,29.67,22.35,21.9,1999,12,18
12/19/1999,2918,4201,1196,29.67,22.35,21.9,1999,12,19
12/20/1999,1875,4717,1482,29.67,22.35,21.9,1999,12,20
12/21/1999,3940,4760,1201,29.67,22.35,21.9,1999,12,21
12/22/1999,2054,4526,1638,29.67,22.35,21.9,1999,12,22
12/23/1999,2744,4281,1155,29.67,22.35,21.9,1999,12,23
12/24/1999,2427,4626,976,29.67,22.35,21.9,1999,12,24
12/25/1999,2446,4166,837,29.67,22.35,21.9,1999,12,25
12/26/1999,3221,5010,708,29.67,22.35,21.9,1999,12,26
12/27/1999,1570,4709,701,29.67,22.35,21.9,1999,12,27
12/28/1999,2461,5329,1075,29.67,22.35,21.9,1999,12,28
12/29/1999,1746,4662,1081,29.67,22.35,21.9,1999,12,29
12/30/1999,1829,5011,971,29.67,22.35,21.9,1999,12,30
12/31/1999,2154,3830,525,29.67,22.35,21.9,1999,12,31
1/1/2000,1905,4118,1450,29.69,22.39,22.08,2000,1,1
1/2/2000,2674,5118,789,29.88,22.42,22.16,2000,1,2
1/3/2000,1484,4644,1420,29.93,22.42,22.16,2000,1,3
1/4/2000,2465,5279,678,29.97,22.54,22.17,2000,1,4
1/5/2000,1822,4211,1035,29.97,22.55,22.17,2000,1,5
1/6/2000,1512,4710,1231,29.97,22.55,22.17,2000,1,6
1/7/2000,1692,5513,508,29.97,22.55,22.17,2000,1,7
1/8/2000,1314,4338,1004,29.97,22.55,22.17,2000,1,8
1/9/2000,1377,3942,542,29.97,22.6,22.17,2000,1,9
1/10/2000,1113,6085,777,30.32,22.97,22.24,2000,1,10
1/11/2000,6175,12007,972,33.74,27.08,24.26,2000,1,11
1/12/2000,3492,7562,1428,35.83,27.1,25.56,2000,1,12
1/13/2000,3141,9531,1332,36.13,28.65,25.58,2000,1,13
1/14/2000,3210,19097,1353,36.17,31.43,25.58,2000,1,14
1/15/2000,4502,19097,1032,37.96,32.45,27.38,2000,1,15
1/16/2000,8172,33201,2136,41.1,36.26,30.33,2000,1,16
1/17/2000,5749,19105,2395,41.66,38.11,31.68,2000,1,17
1/18/2000,8688,15978,5371,46.09,38.76,36.03,2000,1,18
1/19/2000,9066,18559,8126,48.17,40.16,37.94,2000,1,19
1/20/2000,10400,25221,6643,48.94,42.39,40.22,2000,1,20
1/21/2000,6204,18891,5048,49.75,42.91,40.86,2000,1,21
1/22/2000,6638,15887,3352,50.33,43.21,41.66,2000,1,22
1/23/2000,6793,17669,3378,52.8,44.07,43.71,2000,1,23
1/24/2000,14862,22843,21476,57.98,46.43,50.1,2000,1,24
1/25/2000,14874,22359,25370,62.49,47.47,54.2,2000,1,25
1/26/2000,9742,17778,11331,63.61,47.51,54.8,2000,1,26
1/27/2000,7558,14605,6963,63.61,47.51,54.8,2000,1,27
1/28/2000,7147,12781,5003,63.61,47.51,54.8,2000,1,28
1/29/2000,6240,12275,3314,63.61,47.51,54.8,2000,1,29
1/30/2000,7440,14848,4244,64.78,49.29,55.89,2000,1,30
1/31/2000,7200,15031,4616,67.06,50.13,57.32,2000,1,31
2/1/2000,5865,13958,4271,67.18,50.86,57.38,2000,2,1
2/2/2000,6268,14114,3052,67.18,50.87,57.38,2000,2,2
2/3/2000,6141,13247,3293,68.25,50.87,58.27,2000,2,3
2/4/2000,6394,12562,4441,69.21,51.99,60.32,2000,2,4
2/5/2000,5807,19268,4558,69.81,54.76,60.42,2000,2,5
2/6/2000,6674,22696,3488,70.11,56,60.42,2000,2,6
2/7/2000,6206,16890,3309,70.11,56,60.42,2000,2,7
2/8/2000,5311,15113,3168,70.11,56,60.42,2000,2,8
2/9/2000,5134,12650,3578,70.36,56.06,60.79,2000,2,9
2/10/2000,8075,14694,3968,72.7,57.39,62.34,2000,2,10
2/11/2000,10393,22723,6694,76.66,59.41,64.57,2000,2,11
2/12/2000,12596,35195,16322,80.27,63.09,66.88,2000,2,12
2/13/2000,21915,49763,19927,86.63,67.22,72.56,2000,2,13
2/14/2000,55945,73332,46576,94.32,72.63,77.79,2000,2,14
2/15/2000,31290,39925,25213,95.81,72.75,79.04,2000,2,15
2/16/2000,21183,29786,16448,96.33,72.98,80.05,2000,2,16
2/17/2000,15373,23499,12292,96.59,73.08,80.55,2000,2,17
2/18/2000,11579,20717,9344,96.67,73.08,80.66,2000,2,18
2/19/2000,10394,16402,8001,96.68,73.08,80.67,2000,2,19
2/20/2000,8977,16939,6695,97.56,73.33,80.98,2000,2,20
2/21/2000,10074,17016,6840,98.22,74.76,81.53,2000,2,21
2/22/2000,12838,29161,9221,101.96,78.03,84.13,2000,2,22
2/23/2000,16257,32418,17108,105.13,80.93,87.14,2000,2,23
2/24/2000,11727,24172,10563,105.17,80.93,87.33,2000,2,24
2/25/2000,9543,20947,7586,105.5,81.35,87.5,2000,2,25
2/26/2000,15264,37116,7044,110.5,85.03,89.34,2000,2,26
2/27/2000,36162,54464,24442,115.52,89.52,93.42,2000,2,27
2/28/2000,22869,40057,19085,118.55,90.28,95.75,2000,2,28
2/29/2000,20782,40882,13475,120.32,93.51,96.92,2000,2,29
3/1/2000,15737,32203,11561,120.52,93.64,97.25,2000,3,1
3/2/2000,14091,27280,10024,120.66,94.05,97.33,2000,3,2
3/3/2000,13365,21471,8475,120.93,94.2,97.4,2000,3,3
3/4/2000,12234,21443,6586,122,94.26,97.4,2000,3,4
3/5/2000,17266,23896,8034,124.03,96.5,98.41,2000,3,5
3/6/2000,14469,21760,8586,124.75,96.82,98.99,2000,3,6
3/7/2000,12243,22396,7634,125.55,97.53,99.84,2000,3,7
3/8/2000,13353,25073,8307,127.43,99.7,101.73,2000,3,8
3/9/2000,14380,27168,8651,129.88,101.14,103.16,2000,3,9
3/10/2000,12870,24326,7928,130.37,101.47,103.33,2000,3,10
3/11/2000,11673,25133,7069,130.69,102.43,103.49,2000,3,11
3/12/2000,11346,22276,6665,130.69,102.53,103.49,2000,3,12
3/13/2000,10547,19849,6517,130.69,102.53,103.49,2000,3,13
3/14/2000,9292,18925,6517,130.69,102.53,103.49,2000,3,14
3/15/2000,11475,16768,6899,130.69,102.53,103.49,2000,3,15
3/16/2000,10079,16132,7141,130.73,102.53,103.49,2000,3,16
3/17/2000,10488,16194,6648,130.75,102.53,103.49,2000,3,17
3/18/2000,10340,14470,6426,130.75,102.53,103.49,2000,3,18
3/19/2000,8968,13775,5810,130.75,102.55,103.49,2000,3,19
3/20/2000,10935,13633,6363,130.75,102.55,103.49,2000,3,20
3/21/2000,9759,12866,5875,130.75,102.55,103.49,2000,3,21
3/22/2000,8874,12189,5762,130.75,102.55,103.49,2000,3,22
3/23/2000,8619,11783,5848,130.78,102.61,103.49,2000,3,23
3/24/2000,9054,11965,5768,130.78,102.61,103.49,2000,3,24
3/25/2000,8524,11875,5603,130.78,102.61,103.49,2000,3,25
3/26/2000,8260,11147,4484,130.78,102.61,103.49,2000,3,26
3/27/2000,8485,10467,5689,130.78,102.61,103.49,2000,3,27
3/28/2000,8508,11998,6042,130.78,102.61,103.49,2000,3,28
3/29/2000,8081,10296,5905,130.78,102.61,103.49,2000,3,29
3/30/2000,8029,10192,5831,130.78,102.61,103.49,2000,3,30
3/31/2000,7250,11297,4933,130.78,102.61,103.49,2000,3,31
4/1/2000,7569,11741,4465,130.78,102.61,103.49,2000,4,1
4/2/2000,7409,11369,4694,130.78,102.61,103.49,2000,4,2
4/3/2000,8607,9241,5558,130.78,102.61,103.49,2000,4,3
4/4/2000,9059,8927,5774,130.78,102.61,103.49,2000,4,4
4/5/2000,9586,10163,6957,130.78,102.61,103.49,2000,4,5
4/6/2000,9369,10362,5170,130.78,102.61,103.49,2000,4,6
4/7/2000,8677,10220,5105,130.78,102.61,103.49,2000,4,7
4/8/2000,8724,9922,4744,130.78,102.61,103.49,2000,4,8
4/9/2000,8805,9328,4579,130.78,102.61,103.49,2000,4,9
4/10/2000,8266,8152,5097,130.96,102.61,103.49,2000,4,10
4/11/2000,7326,9912,5035,130.96,102.61,103.49,2000,4,11
4/12/2000,8706,10327,4689,131.06,102.67,103.52,2000,4,12
4/13/2000,12189,17079,5975,133.8,105.18,105.44,2000,4,13
4/14/2000,12045,15715,7533,134.3,106.03,106.46,2000,4,14
4/15/2000,10177,14122,6088,134.42,106.89,106.47,2000,4,15
4/16/2000,9845,18398,4649,135.33,108.39,107.36,2000,4,16
4/17/2000,13334,27903,6115,138.41,112.34,108.41,2000,4,17
4/18/2000,11956,19633,5289,138.87,113.31,109.26,2000,4,18
4/19/2000,10554,17724,4978,138.91,113.35,109.28,2000,4,19
4/20/2000,9602,14373,4124,138.91,113.35,109.28,2000,4,20
4/21/2000,8885,14695,3946,138.91,113.35,109.28,2000,4,21
4/22/2000,9194,12475,3765,138.91,113.38,109.41,2000,4,22
4/23/2000,9022,12240,3558,138.93,113.38,109.46,2000,4,23
4/24/2000,7894,12291,3772,138.93,113.38,109.46,2000,4,24
4/25/2000,8504,12648,4315,138.93,113.38,109.46,2000,4,25
4/26/2000,8098,11188,4110,138.93,113.38,109.46,2000,4,26
4/27/2000,7764,10274,4315,138.94,113.38,109.5,2000,4,27
4/28/2000,8658,11309,4744,138.98,113.4,109.58,2000,4,28
4/29/2000,7193,10902,4488,138.98,113.4,109.58,2000,4,29
4/30/2000,6709,11636,3700,138.98,113.4,109.58,2000,4,30
5/1/2000,6585,11922,3520,138.98,113.4,109.58,2000,5,1
5/2/2000,7613,8431,4797,138.98,113.52,109.58,2000,5,2
5/3/2000,7111,7645,4392,138.98,113.52,109.58,2000,5,3
5/4/2000,8608,6932,4649,138.98,113.52,109.58,2000,5,4
5/5/2000,6781,7099,4994,138.98,113.52,109.58,2000,5,5
5/6/2000,7079,7306,4552,139.4,113.61,110.1,2000,5,6
5/7/2000,7172,9181,4523,140.43,114.09,112.46,2000,5,7
5/8/2000,9020,7745,8080,141.41,114.27,115.3,2000,5,8
5/9/2000,7094,7293,8620,141.43,114.27,115.46,2000,5,9
5/10/2000,7292,9744,6003,141.64,114.27,115.52,2000,5,10
5/11/2000,6546,7447,4571,141.99,114.27,115.82,2000,5,11
5/12/2000,6732,8055,4606,141.99,114.27,115.82,2000,5,12
5/13/2000,6313,8356,4233,141.99,114.28,115.82,2000,5,13
5/14/2000,5601,8830,3670,142.36,114.32,115.99,2000,5,14
5/15/2000,6326,8085,5035,143.07,116.13,117.13,2000,5,15
5/16/2000,6921,7201,5584,143.34,118.32,118.91,2000,5,16
5/17/2000,6388,8954,5119,143.43,118.32,118.91,2000,5,17
5/18/2000,6013,7061,4602,143.43,118.32,118.91,2000,5,18
5/19/2000,7354,10044,4884,143.43,118.32,119.41,2000,5,19
5/20/2000,6879,8375,5222,143.43,118.32,119.41,2000,5,20
5/21/2000,6983,7206,4738,143.43,118.32,119.41,2000,5,21
5/22/2000,6715,7601,5193,143.43,118.32,119.41,2000,5,22
5/23/2000,7731,8633,5080,143.43,118.32,119.41,2000,5,23
5/24/2000,6394,9775,5719,143.43,118.32,119.41,2000,5,24
5/25/2000,6646,9561,5692,143.67,118.32,119.41,2000,5,25
5/26/2000,6749,8297,5757,143.67,118.32,119.41,2000,5,26
5/27/2000,6855,8886,5237,143.67,118.32,119.41,2000,5,27
5/28/2000,5865,8594,5679,143.67,118.32,119.41,2000,5,28
5/29/2000,5520,5434,5023,143.67,118.32,119.41,2000,5,29
5/30/2000,4330,6182,5138,143.67,118.32,119.41,2000,5,30
5/31/2000,4493,3744,4660,143.67,118.32,119.41,2000,5,31
6/1/2000,4249,5841,4157,143.67,118.32,119.41,2000,6,1
6/2/2000,4206,6953,3799,143.67,118.32,119.41,2000,6,2
6/3/2000,3946,5683,3186,143.67,118.32,119.41,2000,6,3
6/4/2000,3944,5856,3163,143.67,118.32,119.41,2000,6,4
6/5/2000,3049,6258,3128,143.67,118.32,119.41,2000,6,5
6/6/2000,3233,3943,3291,143.67,118.32,119.41,2000,6,6
6/7/2000,3341,8403,3158,143.67,118.32,119.41,2000,6,7
6/8/2000,3782,6132,3706,144.7,119.22,122.15,2000,6,8
6/9/2000,3666,6014,3536,144.95,119.69,122.29,2000,6,9
6/10/2000,3362,4999,2720,144.95,119.8,122.29,2000,6,10
6/11/2000,3845,4755,2635,144.95,119.8,122.29,2000,6,11
6/12/2000,2386,5979,2913,144.95,119.8,122.29,2000,6,12
6/13/2000,4412,6290,3607,144.95,119.8,122.29,2000,6,13
6/14/2000,3706,6903,3521,144.95,119.8,122.29,2000,6,14
6/15/2000,4686,7304,4206,144.95,119.8,122.29,2000,6,15
6/16/2000,3126,7287,3251,144.95,119.8,122.29,2000,6,16
6/17/2000,3885,4346,2915,144.95,119.8,122.29,2000,6,17
6/18/2000,3791,6204,2825,144.95,119.8,122.29,2000,6,18
6/19/2000,3272,5748,2104,144.95,119.8,122.29,2000,6,19
6/20/2000,2576,6191,3643,144.95,119.8,122.29,2000,6,20
6/21/2000,3236,6026,3054,144.95,119.8,122.29,2000,6,21
6/22/2000,3427,4960,2727,144.95,119.8,122.29,2000,6,22
6/23/2000,2074,4998,1936,144.95,119.8,122.29,2000,6,23
6/24/2000,2744,3648,1486,144.95,119.8,122.29,2000,6,24
6/25/2000,2994,4565,1603,144.95,119.8,122.29,2000,6,25
6/26/2000,3056,6457,2652,145.3,119.8,122.29,2000,6,26
6/27/2000,2657,6642,3276,145.3,119.8,122.29,2000,6,27
6/28/2000,3388,5945,2905,145.3,119.8,122.29,2000,6,28
6/29/2000,2567,5134,2462,145.3,119.8,122.29,2000,6,29
6/30/2000,3793,6840,1933,145.3,119.8,122.29,2000,6,30
7/1/2000,2459,5535,1641,145.3,119.8,122.29,2000,7,1
7/2/2000,3377,4687,1198,145.3,120.14,122.29,2000,7,2
7/3/2000,2192,4447,1125,145.3,120.34,122.29,2000,7,3
7/4/2000,3643,1641,1191,145.3,120.34,122.29,2000,7,4
7/5/2000,2678,3789,1503,145.3,121.48,122.29,2000,7,5
7/6/2000,2455,5335,1544,145.3,121.48,122.29,2000,7,6
7/7/2000,3088,5300,1456,145.3,121.49,122.29,2000,7,7
7/8/2000,3683,3336,1348,145.3,121.49,122.29,2000,7,8
7/9/2000,2659,4438,1764,145.3,121.49,122.29,2000,7,9
7/10/2000,3322,5459,1462,145.3,121.49,122.29,2000,7,10
7/11/2000,1962,4611,2021,145.3,121.49,122.29,2000,7,11
7/12/2000,2828,5974,1896,145.3,121.49,122.29,2000,7,12
7/13/2000,2560,5441,1597,145.3,121.49,122.29,2000,7,13
7/14/2000,2179,4773,1702,145.3,121.49,122.29,2000,7,14
7/15/2000,3297,2199,1874,145.3,121.49,122.29,2000,7,15
7/16/2000,3016,1822,993,145.3,121.49,122.29,2000,7,16
7/17/2000,2772,5200,1622,145.3,121.49,122.29,2000,7,17
7/18/2000,2936,5254,1877,145.3,121.49,122.29,2000,7,18
7/19/2000,3025,5567,2310,145.3,121.49,122.29,2000,7,19
7/20/2000,2742,5100,1979,145.3,121.49,122.29,2000,7,20
7/21/2000,2816,4953,1524,145.3,121.49,122.29,2000,7,21
7/22/2000,2868,3521,1807,145.3,121.49,122.29,2000,7,22
7/23/2000,3083,3125,1609,145.3,121.49,122.29,2000,7,23
7/24/2000,2931,4388,1920,145.3,121.49,122.29,2000,7,24
7/25/2000,3092,5079,2007,145.3,121.49,122.29,2000,7,25
7/26/2000,2892,5120,1773,145.3,121.49,122.29,2000,7,26
7/27/2000,3117,4656,2450,145.3,121.49,122.29,2000,7,27
7/28/2000,3478,5788,2473,145.3,121.49,122.29,2000,7,28
7/29/2000,1589,5822,2319,145.3,121.49,122.29,2000,7,29
7/30/2000,2752,4801,1396,145.3,121.49,122.29,2000,7,30
7/31/2000,3955,6344,2350,145.3,121.49,122.29,2000,7,31
8/1/2000,2326,5813,2569,145.3,121.49,122.29,2000,8,1
8/2/2000,3338,5849,2996,145.3,121.49,122.29,2000,8,2
8/3/2000,2796,6267,2083,145.3,121.49,122.29,2000,8,3
8/4/2000,3438,5027,2354,145.3,121.49,122.29,2000,8,4
8/5/2000,2760,1504,2194,145.3,121.49,122.29,2000,8,5
8/6/2000,2493,1756,1932,145.3,121.49,122.29,2000,8,6
8/7/2000,2546,5605,1399,145.3,121.49,122.31,2000,8,7
8/8/2000,3284,4699,1373,145.3,121.49,122.31,2000,8,8
8/9/2000,2509,4884,2238,145.3,121.98,122.31,2000,8,9
8/10/2000,2877,5090,2093,145.3,121.98,122.31,2000,8,10
8/11/2000,2600,4923,2400,145.3,121.98,122.31,2000,8,11
8/12/2000,2280,3159,2379,145.3,121.98,122.31,2000,8,12
8/13/2000,3005,2080,1669,145.3,121.98,122.31,2000,8,13
8/14/2000,2627,4264,1914,145.3,121.98,122.31,2000,8,14
8/15/2000,2662,3949,2531,145.3,121.98,122.31,2000,8,15
8/16/2000,2706,5364,3012,145.3,121.98,122.31,2000,8,16
8/17/2000,1711,4506,2814,145.3,121.98,122.31,2000,8,17
8/18/2000,2254,4286,1982,145.3,121.98,122.31,2000,8,18
8/19/2000,2138,4934,1931,145.3,121.98,122.31,2000,8,19
8/20/2000,1028,3601,1451,145.3,121.98,122.31,2000,8,20
8/21/2000,760,4998,2018,145.3,121.98,122.31,2000,8,21
8/22/2000,1171,4152,2944,145.3,121.98,122.31,2000,8,22
8/23/2000,3092,4374,2456,145.3,121.98,122.31,2000,8,23
8/24/2000,3139,4376,2533,145.3,121.98,122.31,2000,8,24
8/25/2000,3000,4794,2407,145.3,121.98,122.31,2000,8,25
8/26/2000,2580,2325,2212,145.3,121.98,122.31,2000,8,26
8/27/2000,2262,3434,1596,145.3,121.98,122.31,2000,8,27
8/28/2000,3011,3612,1719,145.3,121.98,122.31,2000,8,28
8/29/2000,2826,3560,1909,145.3,121.98,122.31,2000,8,29
8/30/2000,1782,3952,1303,145.3,121.98,122.33,2000,8,30
8/31/2000,2571,3916,1910,145.3,121.98,122.33,2000,8,31
9/1/2000,2898,7023,2007,146.02,123.51,123.57,2000,9,1
9/2/2000,3069,4201,2057,146.77,125.08,125.96,2000,9,2
9/3/2000,2265,4472,1743,146.81,125.33,126.13,2000,9,3
9/4/2000,1685,4809,1663,146.81,125.5,126.13,2000,9,4
9/5/2000,2246,5010,1636,146.81,125.53,126.15,2000,9,5
9/6/2000,1608,5449,2190,146.81,125.53,126.15,2000,9,6
9/7/2000,2875,5820,2268,146.81,125.53,126.15,2000,9,7
9/8/2000,1499,5317,3800,146.81,125.53,126.15,2000,9,8
9/9/2000,2276,2316,2287,146.81,125.53,126.15,2000,9,9
9/10/2000,3170,2755,1785,146.81,125.53,126.15,2000,9,10
9/11/2000,2210,3044,2126,146.81,125.53,126.15,2000,9,11
9/12/2000,1908,4105,2500,146.81,125.53,126.15,2000,9,12
9/13/2000,2098,6162,3306,146.81,125.53,126.15,2000,9,13
9/14/2000,2377,4959,2729,146.81,125.53,126.15,2000,9,14
9/15/2000,3089,4919,1710,146.81,125.54,126.15,2000,9,15
9/16/2000,1875,3506,1320,146.81,125.54,126.15,2000,9,16
9/17/2000,2666,2206,1469,146.81,125.54,126.15,2000,9,17
9/18/2000,2757,5278,2577,146.81,125.54,126.15,2000,9,18
9/19/2000,2717,5453,2396,146.81,125.54,126.15,2000,9,19
9/20/2000,1123,4696,2611,146.81,125.54,126.15,2000,9,20
9/21/2000,2816,4547,2142,146.81,125.54,126.15,2000,9,21
9/22/2000,3293,5563,1300,147.03,125.54,126.26,2000,9,22
9/23/2000,2757,4277,1139,147.03,126.04,126.46,2000,9,23
9/24/2000,2374,4552,823,147.03,126.04,126.46,2000,9,24
9/25/2000,2204,4231,994,147.03,126.04,126.46,2000,9,25
9/26/2000,2085,3693,1516,147.03,126.04,126.46,2000,9,26
9/27/2000,1790,3712,1026,147.03,126.04,126.46,2000,9,27
9/28/2000,2269,3509,769,147.03,126.04,126.46,2000,9,28
9/29/2000,2096,4503,864,147.03,126.04,126.46,2000,9,29
9/30/2000,2903,4402,772,147.03,126.04,126.46,2000,9,30
10/1/2000,2982,3262,1107,0,0,0,2000,10,1
10/2/2000,2335,3793,1432,0,0,0,2000,10,2
10/3/2000,2771,4437,1357,0,0,0,2000,10,3
10/4/2000,3377,3671,631,0,0,0,2000,10,4
10/5/2000,2557,4901,908,0,0,0,2000,10,5
10/6/2000,2197,4262,1507,0,0,0,2000,10,6
10/7/2000,2143,4409,712,0,0,0,2000,10,7
10/8/2000,2599,3484,586,0,0,0,2000,10,8
10/9/2000,2190,4500,554,1.01,0.38,1.17,2000,10,9
10/10/2000,2335,6331,582,2.74,0.7,3.75,2000,10,10
10/11/2000,2745,5841,1053,3.7,1.16,4.45,2000,10,11
10/12/2000,3174,5340,645,3.82,1.19,4.67,2000,10,12
10/13/2000,2032,6189,521,3.82,1.19,4.68,2000,10,13
10/14/2000,3020,2979,688,3.82,1.19,4.68,2000,10,14
10/15/2000,2595,3915,478,3.82,1.19,4.68,2000,10,15
10/16/2000,2478,5716,129,3.82,1.19,4.68,2000,10,16
10/17/2000,1734,5105,273,3.82,1.19,4.68,2000,10,17
10/18/2000,3157,3767,171,3.82,1.19,4.68,2000,10,18
10/19/2000,2675,4715,319,3.82,1.19,4.68,2000,10,19
10/20/2000,819,3826,180,4.31,1.46,4.82,2000,10,20
10/21/2000,984,4336,363,4.39,1.72,4.91,2000,10,21
10/22/2000,988,4314,-112,4.39,1.72,4.91,2000,10,22
10/23/2000,1561,3992,118,4.39,1.72,4.91,2000,10,23
10/24/2000,2042,3680,673,4.39,1.72,4.91,2000,10,24
10/25/2000,2944,4234,1159,4.97,2.08,5.86,2000,10,25
10/26/2000,1948,4318,1607,5.48,3.46,7.27,2000,10,26
10/27/2000,3062,5122,1339,5.8,3.47,7.4,2000,10,27
10/28/2000,3045,6703,1975,8.21,4.8,10.2,2000,10,28
10/29/2000,4229,6448,2416,11.03,5.85,12.99,2000,10,29
10/30/2000,3014,7327,2098,12.3,6.86,13.68,2000,10,30
10/31/2000,2547,5773,2066,12.3,6.87,13.71,2000,10,31
11/1/2000,2127,5656,1356,12.3,6.87,13.71,2000,11,1
11/2/2000,2861,2070,1934,12.3,6.91,13.71,2000,11,2
11/3/2000,2483,3570,1795,12.3,6.91,13.71,2000,11,3
11/4/2000,3153,4158,1435,12.3,6.91,13.71,2000,11,4
11/5/2000,2676,5884,872,12.3,6.91,13.71,2000,11,5
11/6/2000,2019,4864,1185,12.3,6.91,13.71,2000,11,6
11/7/2000,3008,5226,1808,12.3,6.91,13.71,2000,11,7
11/8/2000,1743,5088,1419,12.32,6.96,13.71,2000,11,8
11/9/2000,2460,5085,1856,12.38,6.96,13.73,2000,11,9
11/10/2000,3019,4889,1884,13,7.11,14.15,2000,11,10
11/11/2000,2320,3398,2341,13.06,7.11,14.93,2000,11,11
11/12/2000,2512,4359,1313,13.06,7.11,15.07,2000,11,12
11/13/2000,2440,5092,2501,13.87,7.23,15.54,2000,11,13
11/14/2000,1888,5032,3111,14.46,7.94,16.01,2000,11,14
11/15/2000,2172,5578,2265,14.46,7.94,16.01,2000,11,15
11/16/2000,3051,6430,2402,14.46,7.94,16.01,2000,11,16
11/17/2000,2493,4291,2656,14.46,7.94,16.01,2000,11,17
11/18/2000,2520,3398,2966,14.46,7.94,16.01,2000,11,18
11/19/2000,2385,4680,2528,14.46,7.94,16.01,2000,11,19
11/20/2000,2457,4236,2106,14.46,7.94,16.01,2000,11,20
11/21/2000,1898,4666,2120,14.49,7.94,16.11,2000,11,21
11/22/2000,2908,4592,2437,14.49,7.94,16.17,2000,11,22
11/23/2000,1728,3145,1682,14.49,7.94,16.17,2000,11,23
11/24/2000,1058,3663,1153,14.49,7.94,16.17,2000,11,24
11/25/2000,2263,4077,1151,14.49,7.94,16.17,2000,11,25
11/26/2000,1555,2500,1248,14.49,7.94,16.17,2000,11,26
11/27/2000,2258,4066,1687,14.55,7.97,16.17,2000,11,27
11/28/2000,1590,4553,2445,14.55,7.97,16.17,2000,11,28
11/29/2000,3246,6045,2507,16.16,9.43,17.43,2000,11,29
11/30/2000,2818,5422,2200,17.56,9.58,18.6,2000,11,30
12/1/2000,2419,5774,2319,17.56,9.58,18.6,2000,12,1
12/2/2000,2585,4931,2255,17.56,9.58,18.6,2000,12,2
12/3/2000,1922,5225,2127,17.56,9.58,18.6,2000,12,3
12/4/2000,2046,5239,2314,17.56,9.58,18.6,2000,12,4
12/5/2000,2606,5740,2265,17.56,9.58,18.6,2000,12,5
12/6/2000,2039,5319,2690,17.56,9.58,18.6,2000,12,6
12/7/2000,2401,5607,2651,17.56,9.58,18.6,2000,12,7
12/8/2000,3177,3918,2090,17.56,9.58,18.6,2000,12,8
12/9/2000,2429,3084,1354,17.87,9.6,18.83,2000,12,9
12/10/2000,3060,2698,1572,18.28,9.67,19.21,2000,12,10
12/11/2000,2845,6006,2433,18.85,9.87,19.7,2000,12,11
12/12/2000,3244,5297,3604,19.47,10.38,21.05,2000,12,12
12/13/2000,3317,8210,2774,21.42,10.72,21.77,2000,12,13
12/14/2000,4017,8120,2450,23.72,12.67,23.99,2000,12,14
12/15/2000,3161,7556,2820,23.92,13.8,24.94,2000,12,15
12/16/2000,3603,4699,2203,23.92,13.8,24.94,2000,12,16
12/17/2000,3665,4620,1526,23.92,13.8,24.94,2000,12,17
12/18/2000,2814,5041,2452,23.92,13.8,24.94,2000,12,18
12/19/2000,3653,5978,3042,23.92,13.8,24.94,2000,12,19
12/20/2000,2496,6162,2126,23.92,13.8,24.94,2000,12,20
12/21/2000,2296,4833,2045,24.22,13.95,25.37,2000,12,21
12/22/2000,3222,6145,1900,24.62,14.21,25.39,2000,12,22
12/23/2000,2786,3922,1410,24.64,14.34,25.39,2000,12,23
12/24/2000,2405,2523,1876,24.7,14.37,25.39,2000,12,24
12/25/2000,2643,2364,1767,24.7,14.37,25.39,2000,12,25
12/26/2000,2527,4096,1558,24.7,14.37,25.39,2000,12,26
12/27/2000,2852,5017,1682,24.7,14.37,25.39,2000,12,27
12/28/2000,1674,5385,1696,24.7,14.37,25.39,2000,12,28
12/29/2000,2765,6198,2114,24.7,14.37,25.39,2000,12,29
12/30/2000,2183,4543,978,24.7,14.37,25.39,2000,12,30
12/31/2000,2211,3550,913,24.7,14.37,25.39,2000,12,31
1/1/2001,2169,3617,1548,24.7,14.37,25.39,2001,1,1
1/2/2001,1443,3991,1357,24.7,14.37,25.39,2001,1,2
1/3/2001,2610,4553,1544,24.7,14.37,25.39,2001,1,3
1/4/2001,2247,4655,1199,24.7,14.37,25.39,2001,1,4
1/5/2001,1598,4729,1344,24.7,14.37,25.39,2001,1,5
1/6/2001,2882,3804,1163,24.7,14.37,25.39,2001,1,6
1/7/2001,2111,2311,1010,24.7,14.37,25.39,2001,1,7
1/8/2001,2649,6448,1194,26.01,15.41,25.92,2001,1,8
1/9/2001,3098,6032,1097,26.98,15.55,26.6,2001,1,9
1/10/2001,3379,9758,1970,28.17,16.4,27.8,2001,1,10
1/11/2001,3744,9313,2561,30.81,18.45,30.64,2001,1,11
1/12/2001,3310,6771,1860,31.3,18.47,30.84,2001,1,12
1/13/2001,2981,4930,1156,31.34,18.47,30.89,2001,1,13
1/14/2001,2524,5539,1217,31.37,18.52,30.9,2001,1,14
1/15/2001,2425,5160,1000,31.37,18.52,30.9,2001,1,15
1/16/2001,1787,5146,1163,31.37,18.52,30.9,2001,1,16
1/17/2001,2549,5533,1187,31.37,18.52,30.9,2001,1,17
1/18/2001,3071,4892,1546,31.37,18.52,30.9,2001,1,18
1/19/2001,2341,5636,1185,31.37,18.52,30.9,2001,1,19
1/20/2001,2476,4425,1540,31.37,18.52,30.9,2001,1,20
1/21/2001,2274,3314,1193,31.37,18.52,30.9,2001,1,21
1/22/2001,2272,4320,1722,31.37,18.52,30.9,2001,1,22
1/23/2001,2415,5675,1667,32.53,18.52,31.53,2001,1,23
1/24/2001,2853,6814,2169,33.66,21.05,33.44,2001,1,24
1/25/2001,3225,8179,2332,34.83,21.2,34.76,2001,1,25
1/26/2001,2981,7917,2338,35.75,23.11,35.83,2001,1,26
1/27/2001,2620,5130,1727,35.75,23.14,35.83,2001,1,27
1/28/2001,2736,4137,978,35.75,23.14,35.83,2001,1,28
1/29/2001,2724,6299,1267,36.38,23.16,36.23,2001,1,29
1/30/2001,1894,6186,1118,36.41,23.16,36.35,2001,1,30
1/31/2001,2974,5096,1115,36.41,23.16,36.35,2001,1,31
2/1/2001,2511,6261,1167,36.41,23.16,36.35,2001,2,1
2/2/2001,2427,5488,861,36.41,23.18,36.35,2001,2,2
2/3/2001,1666,2429,740,36.41,23.18,36.35,2001,2,3
2/4/2001,1612,3004,906,36.41,23.18,36.35,2001,2,4
2/5/2001,1457,5928,884,36.41,23.18,36.35,2001,2,5
2/6/2001,2295,5452,1184,36.52,23.18,36.46,2001,2,6
2/7/2001,1855,5620,1352,37.02,23.18,36.87,2001,2,7
2/8/2001,1852,5686,965,37.15,23.18,36.88,2001,2,8
2/9/2001,3385,8164,1028,39.21,23.88,38.2,2001,2,9
2/10/2001,2405,5572,2328,43.16,26.46,41.31,2001,2,10
2/11/2001,4019,7077,3233,46.31,27.58,43.45,2001,2,11
2/12/2001,2637,7053,2799,47.44,28.63,44.41,2001,2,12
2/13/2001,2896,6243,2343,47.44,28.63,44.41,2001,2,13
2/14/2001,2276,7386,1627,47.44,28.63,44.41,2001,2,14
2/15/2001,2543,5961,1746,47.44,28.63,44.41,2001,2,15
2/16/2001,2166,5466,2008,47.44,28.72,44.41,2001,2,16
2/17/2001,1910,6151,1426,47.8,28.72,44.41,2001,2,17
2/18/2001,2533,9935,1520,48.74,29.72,44.83,2001,2,18
2/19/2001,4093,12904,2024,50.42,30.58,46.22,2001,2,19
2/20/2001,5930,23153,3301,53.21,32.31,48.27,2001,2,20
2/21/2001,8956,34288,3063,56.34,34.11,50.36,2001,2,21
2/22/2001,6923,24919,3582,58.38,35.88,51.4,2001,2,22
2/23/2001,4778,16205,4275,59.17,35.92,52.22,2001,2,23
2/24/2001,4404,14575,3857,60.58,36.54,53.36,2001,2,24
2/25/2001,4223,13875,3724,61.22,38.24,54.21,2001,2,25
2/26/2001,3692,12744,2956,61.41,38.36,54.21,2001,2,26
2/27/2001,3715,10682,2537,61.41,38.36,54.21,2001,2,27
2/28/2001,3038,9514,2092,61.41,38.36,54.21,2001,2,28
3/1/2001,2893,8908,2039,61.42,38.36,54.21,2001,3,1
3/2/2001,3004,10738,2334,62.46,39.25,55.01,2001,3,2
3/3/2001,2686,7849,2570,62.77,39.29,55.48,2001,3,3
3/4/2001,4432,17961,2956,65.05,40.11,57.06,2001,3,4
3/5/2001,7983,24558,4765,68.16,42.28,58.67,2001,3,5
3/6/2001,5908,15738,3688,68.45,42.48,58.98,2001,3,6
3/7/2001,5011,13325,3200,68.45,42.48,58.98,2001,3,7
3/8/2001,4564,13601,2987,68.45,42.5,58.98,2001,3,8
3/9/2001,5350,12985,2930,69.42,42.5,59.13,2001,3,9
3/10/2001,4411,11038,2724,69.42,42.5,59.53,2001,3,10
3/11/2001,3539,8922,2661,69.42,42.5,59.53,2001,3,11
3/12/2001,3995,8087,2577,69.42,42.5,59.53,2001,3,12
3/13/2001,3261,8903,1945,69.42,42.5,59.53,2001,3,13
3/14/2001,3557,8209,2045,69.42,42.5,59.53,2001,3,14
3/15/2001,3401,8651,2373,69.42,42.5,59.53,2001,3,15
3/16/2001,2906,7432,2378,69.42,42.5,59.53,2001,3,16
3/17/2001,3063,7499,1689,69.42,42.5,59.53,2001,3,17
3/18/2001,2942,6888,1670,69.42,42.5,59.53,2001,3,18
3/19/2001,3792,8522,2172,69.42,42.5,59.53,2001,3,19
3/20/2001,5148,9976,2702,69.42,42.5,59.53,2001,3,20
3/21/2001,6196,8464,3320,69.42,42.5,59.53,2001,3,21
3/22/2001,5068,9661,2921,69.42,42.5,59.53,2001,3,22
3/23/2001,5287,12309,2624,69.44,42.5,59.53,2001,3,23
3/24/2001,5902,8278,2981,70.41,42.5,60.09,2001,3,24
3/25/2001,9066,9279,4327,71.24,42.95,61.57,2001,3,25
3/26/2001,8365,10952,4563,71.48,42.95,61.57,2001,3,26
3/27/2001,5497,9259,3180,71.48,42.95,61.57,2001,3,27
3/28/2001,5786,8696,3555,71.48,42.95,61.57,2001,3,28
3/29/2001,6185,9360,3486,71.48,42.95,61.57,2001,3,29
3/30/2001,6161,9429,3152,71.48,42.95,61.57,2001,3,30
3/31/2001,5714,9710,3274,71.48,42.95,61.57,2001,3,31
4/1/2001,5241,7005,2859,71.48,42.95,61.57,2001,4,1
4/2/2001,4661,7929,3007,71.49,42.95,61.57,2001,4,2
4/3/2001,5390,8066,2949,71.65,42.95,61.61,2001,4,3
4/4/2001,3766,8215,2444,71.77,42.95,61.61,2001,4,4
4/5/2001,3636,7118,2024,71.77,42.95,61.61,2001,4,5
4/6/2001,3323,9626,2546,72.7,43.15,62.55,2001,4,6
4/7/2001,4172,7669,2507,74.91,44.21,65.14,2001,4,7
4/8/2001,3208,7064,2136,75.33,44.21,66.02,2001,4,8
4/9/2001,3005,6279,2104,75.36,44.21,66.22,2001,4,9
4/10/2001,1901,6123,1620,75.36,44.21,66.22,2001,4,10
4/11/2001,3618,6010,2053,75.68,44.21,67.14,2001,4,11
4/12/2001,2568,7244,1629,75.95,44.21,68.03,2001,4,12
4/13/2001,2346,7209,2052,75.95,44.21,68.03,2001,4,13
4/14/2001,3165,5915,1798,75.95,44.21,68.03,2001,4,14
4/15/2001,2483,6432,1570,75.95,44.21,68.03,2001,4,15
4/16/2001,2902,6959,1773,75.95,44.21,68.03,2001,4,16
4/17/2001,3133,6866,2256,75.95,44.21,68.03,2001,4,17
4/18/2001,3292,8642,2515,76.12,44.21,68.73,2001,4,18
4/19/2001,4488,7653,2793,77.6,44.22,70.7,2001,4,19
4/20/2001,4574,8382,4801,79.21,44.61,73.61,2001,4,20
4/21/2001,4056,6069,4284,79.73,45.5,74.46,2001,4,21
4/22/2001,4032,5432,3367,79.73,45.5,74.46,2001,4,22
4/23/2001,3553,6131,3628,79.73,45.5,74.46,2001,4,23
4/24/2001,3766,6744,3781,79.73,45.5,74.46,2001,4,24
4/25/2001,5144,6190,4387,79.73,45.5,74.46,2001,4,25
4/26/2001,5723,7238,4582,79.73,45.5,74.46,2001,4,26
4/27/2001,5780,6629,4937,79.73,45.5,74.46,2001,4,27
4/28/2001,5875,7265,4083,79.73,45.5,74.46,2001,4,28
4/29/2001,5051,7487,3158,79.73,45.5,74.46,2001,4,29
4/30/2001,5058,7856,3233,79.73,45.5,74.46,2001,4,30
5/1/2001,5304,6981,4384,79.73,45.5,74.46,2001,5,1
5/2/2001,5281,5875,3976,79.73,45.5,74.46,2001,5,2
5/3/2001,4426,7179,3778,79.73,45.5,74.46,2001,5,3
5/4/2001,4192,7623,2894,79.73,45.5,74.46,2001,5,4
5/5/2001,3906,5790,2684,79.73,45.5,74.46,2001,5,5
5/6/2001,4089,5472,2669,79.73,45.5,74.46,2001,5,6
5/7/2001,884,7110,2775,79.73,45.5,74.46,2001,5,7
5/8/2001,8857,6816,3826,79.73,45.5,74.46,2001,5,8
5/9/2001,5024,7267,4295,79.73,45.5,74.46,2001,5,9
5/10/2001,5219,7809,3325,79.73,45.5,74.46,2001,5,10
5/11/2001,5201,6176,2874,79.73,45.5,74.46,2001,5,11
5/12/2001,5029,4469,2953,79.73,45.5,74.46,2001,5,12
5/13/2001,4459,5424,2771,79.73,45.5,74.46,2001,5,13
5/14/2001,3594,6976,2370,79.73,45.5,74.46,2001,5,14
5/15/2001,4319,6486,2628,79.77,45.77,74.65,2001,5,15
5/16/2001,3702,6326,2938,79.81,45.79,74.65,2001,5,16
5/17/2001,2993,6983,2496,79.81,45.79,74.65,2001,5,17
5/18/2001,3362,6755,2510,79.81,45.79,74.65,2001,5,18
5/19/2001,3693,5093,1997,79.81,45.79,74.65,2001,5,19
5/20/2001,2946,4069,2136,79.81,45.79,74.65,2001,5,20
5/21/2001,3753,6594,2456,79.81,45.79,74.65,2001,5,21
5/22/2001,3034,6740,2381,79.81,45.79,74.65,2001,5,22
5/23/2001,2484,12196,2074,79.81,45.79,74.65,2001,5,23
5/24/2001,3028,5814,2660,79.81,45.79,74.65,2001,5,24
5/25/2001,1961,4901,2088,79.81,45.79,74.65,2001,5,25
5/26/2001,2032,3267,1611,79.81,45.79,74.65,2001,5,26
5/27/2001,2166,3311,1096,79.81,45.79,74.65,2001,5,27
5/28/2001,1335,3518,965,79.81,45.79,74.65,2001,5,28
5/29/2001,1425,4728,855,79.81,45.79,74.65,2001,5,29
5/30/2001,1940,4982,2215,79.81,45.79,74.65,2001,5,30
5/31/2001,1934,4660,2176,79.81,45.79,74.65,2001,5,31
6/1/2001,1036,4509,1830,79.81,45.79,74.65,2001,6,1
6/2/2001,1485,3089,1274,79.81,45.79,74.65,2001,6,2
6/3/2001,1369,2495,874,79.81,45.79,74.65,2001,6,3
6/4/2001,1603,4376,636,79.81,45.79,74.65,2001,6,4
6/5/2001,666,5652,1166,79.81,45.79,74.65,2001,6,5
6/6/2001,2168,4638,982,79.81,45.79,74.65,2001,6,6
6/7/2001,924,4454,1233,79.81,45.79,74.65,2001,6,7
6/8/2001,1905,5730,1026,79.81,45.79,74.65,2001,6,8
6/9/2001,593,2379,1306,79.81,45.79,74.65,2001,6,9
6/10/2001,1038,2327,877,79.81,45.79,74.65,2001,6,10
6/11/2001,1862,5151,540,79.81,45.79,74.65,2001,6,11
6/12/2001,2197,5202,1020,79.81,45.79,74.65,2001,6,12
6/13/2001,1421,4381,1101,79.81,45.79,74.65,2001,6,13
6/14/2001,1824,4677,1040,79.81,45.79,74.65,2001,6,14
6/15/2001,1760,4887,1101,79.81,45.79,74.65,2001,6,15
6/16/2001,1318,3444,897,79.81,45.79,74.79,2001,6,16
6/17/2001,810,2602,674,79.81,45.79,74.79,2001,6,17
6/18/2001,2175,5346,656,79.81,45.79,74.79,2001,6,18
6/19/2001,1922,4832,1786,79.81,45.79,74.79,2001,6,19
6/20/2001,1622,4820,1548,79.81,45.79,74.79,2001,6,20
6/21/2001,2854,5043,1237,79.81,45.79,74.79,2001,6,21
6/22/2001,1763,5094,1454,79.81,45.79,74.79,2001,6,22
6/23/2001,795,2517,1396,79.81,45.79,74.79,2001,6,23
6/24/2001,1241,2892,479,79.81,45.79,74.79,2001,6,24
6/25/2001,1734,4541,413,80,45.79,74.87,2001,6,25
6/26/2001,2740,5493,757,80.19,45.8,75,2001,6,26
6/27/2001,1183,7323,1007,80.43,47.2,75.04,2001,6,27
6/28/2001,2036,5631,1005,80.46,48.15,75.04,2001,6,28
6/29/2001,1360,4938,986,80.46,48.15,75.04,2001,6,29
6/30/2001,1129,2944,1000,80.46,48.15,75.04,2001,6,30
7/1/2001,1145,2798,808,80.46,48.15,75.04,2001,7,1
7/2/2001,2034,5067,944,80.46,48.15,75.04,2001,7,2
7/3/2001,2281,5304,1754,80.46,48.15,75.04,2001,7,3
7/4/2001,1519,4803,1851,80.46,48.15,75.04,2001,7,4
7/5/2001,1789,5503,958,80.46,48.15,75.04,2001,7,5
7/6/2001,2101,4761,1325,80.46,48.15,75.04,2001,7,6
7/7/2001,1492,3097,1097,80.46,48.15,75.04,2001,7,7
7/8/2001,1156,2826,1143,80.46,48.15,75.04,2001,7,8
7/9/2001,1527,3698,551,80.46,48.15,75.04,2001,7,9
7/10/2001,1100,4736,903,80.46,48.15,75.04,2001,7,10
7/11/2001,2309,2766,759,80.48,48.19,75.04,2001,7,11
7/12/2001,1509,4328,749,80.48,48.19,75.04,2001,7,12
7/13/2001,2352,5169,844,80.48,48.19,75.04,2001,7,13
7/14/2001,1295,3968,930,80.48,48.19,75.04,2001,7,14
7/15/2001,1177,3060,596,80.48,48.19,75.08,2001,7,15
7/16/2001,702,4760,499,80.48,48.19,75.08,2001,7,16
7/17/2001,1645,4397,969,80.48,48.19,75.08,2001,7,17
7/18/2001,1286,3127,743,80.48,48.19,75.08,2001,7,18
7/19/2001,1486,4712,966,80.48,48.19,75.08,2001,7,19
7/20/2001,1587,4829,1028,80.48,48.19,75.08,2001,7,20
7/21/2001,1196,2224,973,80.48,48.19,75.08,2001,7,21
7/22/2001,1354,1507,922,80.48,48.19,75.08,2001,7,22
7/23/2001,1086,4523,762,80.48,48.19,75.08,2001,7,23
7/24/2001,2508,4304,1000,80.48,48.19,75.08,2001,7,24
7/25/2001,1354,5610,1079,80.48,48.19,75.08,2001,7,25
7/26/2001,1255,5349,786,80.48,48.19,75.08,2001,7,26
7/27/2001,1638,4444,955,80.48,48.19,75.08,2001,7,27
7/28/2001,1622,3233,977,80.48,48.19,75.08,2001,7,28
7/29/2001,1018,1594,719,80.48,48.19,75.08,2001,7,29
7/30/2001,1620,4768,758,80.48,48.19,75.08,2001,7,30
7/31/2001,1000,4862,981,80.48,48.19,75.08,2001,7,31
8/1/2001,1293,4734,684,80.48,48.19,75.08,2001,8,1
8/2/2001,1574,4502,876,80.48,48.19,75.08,2001,8,2
8/3/2001,1583,5474,927,80.48,48.19,75.08,2001,8,3
8/4/2001,1701,3598,1008,80.48,48.19,75.08,2001,8,4
8/5/2001,1160,1581,713,80.48,48.19,75.08,2001,8,5
8/6/2001,1189,4318,711,80.48,48.19,75.08,2001,8,6
8/7/2001,1554,4359,832,80.48,48.19,75.08,2001,8,7
8/8/2001,2015,4428,1425,80.48,48.19,75.08,2001,8,8
8/9/2001,998,3402,1357,80.48,48.19,75.08,2001,8,9
8/10/2001,1591,3980,1116,80.48,48.19,75.08,2001,8,10
8/11/2001,1361,3595,1029,80.48,48.19,75.08,2001,8,11
8/12/2001,1121,2163,741,80.48,48.19,75.08,2001,8,12
8/13/2001,1511,3584,646,80.48,48.19,75.08,2001,8,13
8/14/2001,1471,5981,1043,80.48,48.19,75.08,2001,8,14
8/15/2001,1599,6265,830,80.48,48.19,75.08,2001,8,15
8/16/2001,1979,3966,850,80.48,48.19,75.08,2001,8,16
8/17/2001,987,3896,1041,80.48,48.19,75.08,2001,8,17
8/18/2001,1229,2047,1256,80.48,48.19,75.08,2001,8,18
8/19/2001,1529,1555,899,80.48,48.19,75.08,2001,8,19
8/20/2001,1201,7651,806,80.48,48.19,75.08,2001,8,20
8/21/2001,1457,3875,859,80.48,48.19,75.08,2001,8,21
8/22/2001,1307,4179,917,80.48,48.19,75.08,2001,8,22
8/23/2001,2144,4031,790,80.48,48.19,75.08,2001,8,23
8/24/2001,1550,3676,841,80.48,48.19,75.08,2001,8,24
8/25/2001,676,2395,1021,80.48,48.19,75.08,2001,8,25
8/26/2001,1884,2410,970,80.48,48.19,75.08,2001,8,26
8/27/2001,1483,3407,1040,80.48,48.19,75.08,2001,8,27
8/28/2001,358,3718,1374,80.48,48.19,75.08,2001,8,28
8/29/2001,469,4629,916,80.48,48.19,75.08,2001,8,29
8/30/2001,420,3808,1013,80.48,48.19,75.08,2001,8,30
8/31/2001,647,4299,982,80.48,48.19,75.08,2001,8,31
9/1/2001,356,2973,942,80.48,48.19,75.08,2001,9,1
9/2/2001,1152,2438,847,80.48,48.19,75.08,2001,9,2
9/3/2001,369,2577,897,80.48,48.19,75.08,2001,9,3
9/4/2001,-36,3644,713,80.48,48.19,75.08,2001,9,4
9/5/2001,437,4081,689,80.48,48.19,75.08,2001,9,5
9/6/2001,248,3675,861,80.48,48.19,75.08,2001,9,6
9/7/2001,212,4102,930,80.48,48.19,75.08,2001,9,7
9/8/2001,369,3515,697,80.48,48.19,75.08,2001,9,8
9/9/2001,1023,1027,651,80.48,48.19,75.08,2001,9,9
9/10/2001,491,3782,688,80.48,48.19,75.08,2001,9,10
9/11/2001,992,3803,854,80.48,48.19,75.08,2001,9,11
9/12/2001,7,3678,869,80.48,48.19,75.08,2001,9,12
9/13/2001,481,4193,644,80.48,48.19,75.08,2001,9,13
9/14/2001,1178,3976,835,80.48,48.19,75.08,2001,9,14
9/15/2001,453,3679,852,80.48,48.19,75.08,2001,9,15
9/16/2001,980,3743,767,80.48,48.19,75.08,2001,9,16
9/17/2001,1380,3298,965,80.48,48.19,75.08,2001,9,17
9/18/2001,1982,3245,1374,80.48,48.19,75.08,2001,9,18
9/19/2001,1851,3128,1138,80.48,48.19,75.08,2001,9,19
9/20/2001,934,3209,763,80.48,48.19,75.08,2001,9,20
9/21/2001,1751,3277,1001,80.48,48.19,75.08,2001,9,21
9/22/2001,2324,2791,622,80.48,48.19,75.08,2001,9,22
9/23/2001,1820,2980,527,80.48,48.19,75.08,2001,9,23
9/24/2001,1424,3853,592,80.73,48.19,75.08,2001,9,24
9/25/2001,1808,4153,652,82.24,48.84,76,2001,9,25
9/26/2001,1706,3336,686,82.24,49.14,76,2001,9,26
9/27/2001,2324,2893,761,82.24,49.14,76,2001,9,27
9/28/2001,2001,3012,754,82.24,49.14,76,2001,9,28
9/29/2001,1846,3011,1138,82.24,49.14,76,2001,9,29
9/30/2001,1971,3485,4,82.24,49.14,76,2001,9,30
10/1/2001,2060,3130,469,0,0,0,2001,10,1
10/2/2001,1716,3573,429,0,0,0,2001,10,2
10/3/2001,2181,3613,254,0,0,0,2001,10,3
10/4/2001,2124,2350,303,0,0,0,2001,10,4
10/5/2001,2786,3715,153,0,0,0,2001,10,5
10/6/2001,2067,2858,325,0,0,0,2001,10,6
10/7/2001,2134,2851,222,0,0,0,2001,10,7
10/8/2001,1962,3110,349,0,0,0,2001,10,8
10/9/2001,1087,3043,265,0,0,0,2001,10,9
10/10/2001,1894,3514,219,0,0,0,2001,10,10
10/11/2001,1949,3152,293,0,0.01,0,2001,10,11
10/12/2001,2888,3422,266,0,0.01,0,2001,10,12
10/13/2001,1820,3573,270,0,0.01,0,2001,10,13
10/14/2001,2987,2731,231,0,0.01,0,2001,10,14
10/15/2001,1809,3729,243,0,0.01,0,2001,10,15
10/16/2001,2920,3091,234,0,0.01,0,2001,10,16
10/17/2001,2700,3531,164,0,0.01,0,2001,10,17
10/18/2001,3472,3614,157,0,0.01,0,2001,10,18
10/19/2001,2183,3091,195,0,0.01,0,2001,10,19
10/20/2001,2755,2967,304,0,0.01,0,2001,10,20
10/21/2001,2648,2653,127,0,0.01,0,2001,10,21
10/22/2001,2432,3402,280,0,0.01,0,2001,10,22
10/23/2001,1642,3586,306,0,0.01,0,2001,10,23
10/24/2001,1556,3306,26,0,0.01,0,2001,10,24
10/25/2001,729,3523,275,0,0.01,0,2001,10,25
10/26/2001,1305,3595,194,0,0.01,0,2001,10,26
10/27/2001,2151,2642,299,0,0.01,0,2001,10,27
10/28/2001,2381,2406,228,0,0.04,0,2001,10,28
10/29/2001,2493,4554,291,0.1,0.11,0,2001,10,29
10/30/2001,3488,5880,366,3.65,2.85,2.65,2001,10,30
10/31/2001,2893,4260,328,5.15,3.89,2.65,2001,10,31
11/1/2001,1654,3881,351,5.15,3.89,2.65,2001,11,1
11/2/2001,2152,3739,319,5.15,3.89,2.65,2001,11,2
11/3/2001,275,3594,259,5.15,3.89,2.65,2001,11,3
11/4/2001,262,3746,292,5.15,3.89,2.65,2001,11,4
